{
  "pedidos": [
    {
      "tipo": "OS",
      "numero": "95786",
      "nome": "ANDREI",
      "vendedor": "MARCELA",
      "dataInstalacao": "",
      "observacao": "NILO CAIRO",
      "status": "aguardando_retirada",
      "criadoEm": "2026-01-22T18:04:50.000Z",
      "historico": [
        {
          "acao": "Criado",
          "hora": 1769105090000
        },
        {
          "acao": "Impresso por JOAO",
          "hora": 1769105090000
        },
        {
          "acao": "Separado por JUNIOR",
          "hora": 1769105094000
        }
      ]
    },
    {
      "tipo": "OS",
      "numero": "94897",
      "nome": "ANDREI",
      "vendedor": "CAROLINE",
      "dataInstalacao": "",
      "observacao": "MATERIAL SEPARADO NILO CAIRO",
      "status": "aguardando_retirada",
      "criadoEm": "2026-01-22T18:13:26.000Z",
      "historico": [
        {
          "acao": "Criado",
          "hora": 1769105606000
        },
        {
          "acao": "Impresso por S/DADOS",
          "hora": 1769105606000
        },
        {
          "acao": "Separado por JUNIOR",
          "hora": 1769105611000
        }
      ]
    },
    {
      "tipo": "OS",
      "numero": "95233",
      "nome": "ANDREI",
      "vendedor": "JOCISLAINE",
      "dataInstalacao": "",
      "observacao": "",
      "status": "aguardando_retirada",
      "criadoEm": "2026-01-22T18:14:09.000Z",
      "historico": [
        {
          "acao": "Criado",
          "hora": 1769105649000
        },
        {
          "acao": "Impresso por S/DADOS",
          "hora": 1769105649000
        },
        {
          "acao": "Separado por JUNIOR",
          "hora": 1769105655000
        }
      ]
    },
    {
      "tipo": "OS",
      "numero": "94204",
      "nome": "REGINALDO",
      "vendedor": "MARCELA",
      "dataInstalacao": "24/01/2026 - Manhã",
      "observacao": "",
      "status": "aguardando_retirada",
      "criadoEm": "2026-01-24T14:04:04.000Z",
      "historico": [
        {
          "acao": "Criado",
          "hora": 1769263444000
        },
        {
          "acao": "Impresso por JUNIOR",
          "hora": 1769263444000
        },
        {
          "acao": "Separado por FIGUEIREDO",
          "hora": 1769263452000
        }
      ]
    },
    {
      "tipo": "OS",
      "numero": "96942",
      "nome": "TIAGO",
      "vendedor": "ALAN",
      "dataInstalacao": "26/01/2026 - Manhã",
      "observacao": "SEPARAR SOMENTE AQUECEDOR 16L INOX GLP - TIAGO IRA RETIRAR ELA MANAH E DEVOLVER 20 L BRANCO",
      "status": "aguardando_retirada",
      "criadoEm": "2026-01-26T11:07:45.000Z",
      "historico": [
        {
          "acao": "Criado",
          "hora": 1769425665000
        },
        {
          "acao": "Impresso por FIGUEIREDO",
          "hora": 1769425665000
        },
        {
          "acao": "Separado por FIGUEIREDO",
          "hora": 1769425772000
        }
      ]
    },
    {
      "tipo": "OS",
      "numero": "97208",
      "nome": "HENRIQUE",
      "vendedor": "ANDRESSA",
      "dataInstalacao": "27/01/2026 - Tarde",
      "observacao": "",
      "status": "aguardando_retirada",
      "criadoEm": "2026-01-27T13:43:33.000Z",
      "historico": [
        {
          "acao": "Criado",
          "hora": 1769521413000
        },
        {
          "acao": "Impresso por JUNIOR",
          "hora": 1769521413000
        },
        {
          "acao": "Separado por JUNIOR",
          "hora": 1769523593000
        }
      ]
    },
    {
      "tipo": "PV",
      "numero": "144249",
      "nome": "D MARTINS ENGENHARIA",
      "vendedor": "LUIZ",
      "dataInstalacao": "29/01/2026 - Tarde",
      "observacao": "",
      "status": "aguardando_retirada",
      "criadoEm": "2026-01-29T16:57:22.000Z",
      "historico": [
        {
          "acao": "Criado",
          "hora": 1769705842000
        },
        {
          "acao": "Impresso por PAULO",
          "hora": 1769705842000
        },
        {
          "acao": "Separado por FIGUEIREDO",
          "hora": 1769707437000
        }
      ]
    },
    {
      "tipo": "OS",
      "numero": "97409",
      "nome": "CAROL",
      "vendedor": "ALAN",
      "dataInstalacao": "19/02/2026 - Manhã",
      "observacao": "",
      "status": "em_separacao",
      "criadoEm": "2026-02-03T10:26:11.000Z",
      "historico": [
        {
          "acao": "Criado",
          "hora": 1770114371000
        },
        {
          "acao": "Impresso por JUNIOR",
          "hora": 1770114371000
        }
      ]
    },
    {
      "tipo": "OS",
      "numero": "97471",
      "nome": "BRUNO",
      "vendedor": "ANDRESSA",
      "dataInstalacao": "13/02/2026 - Manhã",
      "observacao": "",
      "status": "em_separacao",
      "criadoEm": "2026-02-03T10:24:52.000Z",
      "historico": [
        {
          "acao": "Criado",
          "hora": 1770114292000
        },
        {
          "acao": "Impresso por JUNIOR",
          "hora": 1770114292000
        }
      ]
    },
    {
      "tipo": "OS",
      "numero": "89537",
      "nome": "FABRICIO",
      "vendedor": "ALAN",
      "dataInstalacao": "09/02/2026 - Tarde",
      "observacao": "O.S JA ESTA SEPARADA NA NILO CAIRO",
      "status": "aguardando_retirada",
      "criadoEm": "2026-02-04T12:22:01.000Z",
      "historico": [
        {
          "acao": "Criado",
          "hora": 1770207721000
        },
        {
          "acao": "Impresso por JUNIOR",
          "hora": 1770207721000
        },
        {
          "acao": "Separado por JUNIOR",
          "hora": 1770207728000
        }
      ]
    },
    {
      "tipo": "OS",
      "numero": "97426",
      "nome": "ANDREI",
      "vendedor": "DEBORA",
      "dataInstalacao": "04/02/2026 - Manhã",
      "observacao": "ANDREI REPOSIÇÃO DA MALETA",
      "status": "aguardando_retirada",
      "criadoEm": "2026-02-04T13:06:19.000Z",
      "historico": [
        {
          "acao": "Criado",
          "hora": 1770210379000
        },
        {
          "acao": "Impresso por JUNIOR",
          "hora": 1770210379000
        },
        {
          "acao": "Separado por JUNIOR",
          "hora": 1770211437000
        }
      ]
    },
    {
      "tipo": "OS",
      "numero": "97568",
      "nome": "FABRICIO",
      "vendedor": "TIAGO TROJAN",
      "dataInstalacao": "05/02/2026 - Tarde",
      "observacao": "",
      "status": "em_separacao",
      "criadoEm": "2026-02-04T15:39:37.000Z",
      "historico": [
        {
          "acao": "Criado",
          "hora": 1770219577000
        },
        {
          "acao": "Impresso por JUNIOR",
          "hora": 1770219577000
        }
      ]
    },
    {
      "tipo": "OS",
      "numero": "97592",
      "nome": "TIAGO",
      "vendedor": "MARCELA",
      "dataInstalacao": "05/02/2026 - Manhã",
      "observacao": "APENAS AQUECEDOR",
      "status": "aguardando_retirada",
      "criadoEm": "2026-02-04T19:57:53.000Z",
      "historico": [
        {
          "acao": "Criado",
          "hora": 1770235073000
        },
        {
          "acao": "Impresso por JUNIOR",
          "hora": 1770235073000
        },
        {
          "acao": "Separado por JUNIOR",
          "hora": 1770237605000
        }
      ]
    },
    {
      "tipo": "OS",
      "numero": "95613",
      "nome": "ANDREI",
      "vendedor": "CAROL",
      "dataInstalacao": "13/02/2026 - Manhã",
      "observacao": "",
      "status": "em_separacao",
      "criadoEm": "2026-02-05T14:50:29.000Z",
      "historico": [
        {
          "acao": "Criado",
          "hora": 1770303029000
        },
        {
          "acao": "Impresso por JUNIOR",
          "hora": 1770303029000
        }
      ]
    },
    {
      "tipo": "OS",
      "numero": "95217",
      "nome": "HENRIQUE",
      "vendedor": "ALAN",
      "dataInstalacao": "10/02/2026 - Manhã",
      "observacao": "",
      "status": "em_separacao",
      "criadoEm": "2026-02-05T17:00:23.000Z",
      "historico": [
        {
          "acao": "Criado",
          "hora": 1770310823000
        },
        {
          "acao": "Impresso por BRUNO",
          "hora": 1770310823000
        }
      ]
    },
    {
      "tipo": "OS",
      "numero": "97629",
      "nome": "FABRICIO",
      "vendedor": "MARCELA",
      "dataInstalacao": "09/02/2026 - Manhã",
      "observacao": "CAPA DE PROTEÇÃO PRETA COM CHAPÉU 100MM",
      "status": "aguardando_retirada",
      "criadoEm": "2026-02-05T18:26:30.000Z",
      "historico": [
        {
          "acao": "Criado",
          "hora": 1770315990000
        },
        {
          "acao": "Impresso por JUNIOR",
          "hora": 1770315990000
        },
        {
          "acao": "Separado por JOSE",
          "hora": 1770723379877
        }
      ]
    },
    {
      "tipo": "OS",
      "numero": "97631",
      "nome": "ANDRE",
      "vendedor": "ALAN",
      "dataInstalacao": "09/02/2026 - Manhã",
      "observacao": "",
      "status": "em_separacao",
      "criadoEm": "2026-02-05T18:27:34.000Z",
      "historico": [
        {
          "acao": "Criado",
          "hora": 1770316054000
        },
        {
          "acao": "Impresso por JUNIOR",
          "hora": 1770316054000
        }
      ]
    },
    {
      "tipo": "PV",
      "numero": "144796",
      "nome": "Padrão Solar",
      "vendedor": "Leonardo",
      "dataInstalacao": "06/02/2026 - Manhã",
      "observacao": "",
      "status": "aguardando_retirada",
      "criadoEm": "2026-02-06T14:42:12.000Z",
      "historico": [
        {
          "acao": "Criado",
          "hora": 1770388932000
        },
        {
          "acao": "Impresso por JUNIOR",
          "hora": 1770388932000
        },
        {
          "acao": "Separado por JOAO",
          "hora": 1770405518000
        }
      ]
    },
    {
      "tipo": "OS",
      "numero": "97684",
      "nome": "MARCIO",
      "vendedor": "ALAN",
      "dataInstalacao": "10/02/2026 - Tarde",
      "observacao": "PEGARA JUNTO O.S 97683 MESMO CONDOMINIO",
      "status": "aguardando_retirada",
      "criadoEm": "2026-02-06T18:15:57.000Z",
      "historico": [
        {
          "acao": "Criado",
          "hora": 1770401757000
        },
        {
          "acao": "Impresso por JUNIOR",
          "hora": 1770401757000
        },
        {
          "acao": "Separado por JUNIOR",
          "hora": 1770723396468
        }
      ]
    },
    {
      "tipo": "OS",
      "numero": "97683",
      "nome": "MARCIO",
      "vendedor": "ALAN",
      "dataInstalacao": "10/02/2026 - Tarde",
      "observacao": "PAGARA JUNTO COM O.S 97684",
      "status": "aguardando_retirada",
      "criadoEm": "2026-02-06T18:17:06.000Z",
      "historico": [
        {
          "acao": "Criado",
          "hora": 1770401826000
        },
        {
          "acao": "Impresso por JUNIOR",
          "hora": 1770401826000
        },
        {
          "acao": "Separado por JOSE",
          "hora": 1770723388508
        }
      ]
    },
    {
      "tipo": "OS",
      "numero": "97687",
      "nome": "FABRICIO",
      "vendedor": "ALAN",
      "dataInstalacao": "13/02/2026 - Manhã",
      "observacao": "",
      "status": "em_separacao",
      "criadoEm": "2026-02-06T18:35:33.000Z",
      "historico": [
        {
          "acao": "Criado",
          "hora": 1770402933000
        },
        {
          "acao": "Impresso por JUNIOR",
          "hora": 1770402933000
        }
      ]
    },
    {
      "tipo": "OS",
      "numero": "97677",
      "nome": "MARCIO",
      "vendedor": "BRUNO",
      "dataInstalacao": "06/02/2026 - Tarde",
      "observacao": "",
      "status": "aguardando_retirada",
      "criadoEm": "2026-02-06T19:20:46.000Z",
      "historico": [
        {
          "acao": "Criado",
          "hora": 1770405646000
        },
        {
          "acao": "Impresso por BRUNO",
          "hora": 1770405646000
        },
        {
          "acao": "Separado por JUNIOR",
          "hora": 1770405662000
        }
      ]
    },
    {
      "tipo": "PV",
      "numero": "144830",
      "nome": "Jefferson Artur",
      "vendedor": "Leonardo",
      "dataInstalacao": "06/02/2026 - Tarde",
      "observacao": "",
      "status": "aguardando_retirada",
      "criadoEm": "2026-02-06T20:00:01.000Z",
      "historico": [
        {
          "acao": "Criado",
          "hora": 1770408001000
        },
        {
          "acao": "Impresso por Leonardo",
          "hora": 1770408001000
        },
        {
          "acao": "Separado por paulo",
          "hora": 1770472497000
        }
      ]
    },
    {
      "tipo": "OS",
      "numero": "97691",
      "nome": "Roger",
      "vendedor": "Joci",
      "dataInstalacao": "09/02/2026 - Manhã",
      "observacao": "",
      "status": "em_separacao",
      "criadoEm": "2026-02-06T20:40:47.000Z",
      "historico": [
        {
          "acao": "Criado",
          "hora": 1770410447000
        },
        {
          "acao": "Impresso por JUNIOR",
          "hora": 1770410447000
        }
      ]
    },
    {
      "tipo": "OS",
      "numero": "97622",
      "nome": "ANDREI",
      "vendedor": "CAROL",
      "dataInstalacao": "06/02/2026 - Manhã",
      "observacao": "↺ Reentrado em 07/02/2026, 08:01:42: SERA REMARCADO PARA 09/02 PARA OUTRO TECNICO",
      "status": "aguardando_retirada",
      "criadoEm": "2026-02-07T11:01:53.000Z",
      "historico": [
        {
          "acao": "Criado",
          "hora": 1770462113000
        },
        {
          "acao": "Impresso por PAULO",
          "hora": 1770462113000
        },
        {
          "acao": "Separado por PAULO",
          "hora": 1770462121000
        },
        {
          "acao": "Retirado por ANDREI, conferido por JUNIOR",
          "hora": 1770399062000
        }
      ]
    },
    {
      "tipo": "OS",
      "numero": "97680",
      "nome": "BRUNO",
      "vendedor": "BRUNO",
      "dataInstalacao": "07/02/2026 - Manhã",
      "observacao": "REPOSIÇÃO DE MALETA",
      "status": "aguardando_retirada",
      "criadoEm": "2026-02-07T11:32:14.000Z",
      "historico": [
        {
          "acao": "Criado",
          "hora": 1770463934000
        },
        {
          "acao": "Impresso por BRUNO",
          "hora": 1770463934000
        },
        {
          "acao": "Separado por BRUNO",
          "hora": 1770463941000
        }
      ]
    },
    {
      "tipo": "OS",
      "numero": "97704",
      "nome": "ANDREI",
      "vendedor": "CAROL",
      "dataInstalacao": "12/02/2026 - Manhã",
      "observacao": "",
      "status": "em_separacao",
      "criadoEm": "2026-02-07T13:55:40.000Z",
      "historico": [
        {
          "acao": "Criado",
          "hora": 1770472540000
        },
        {
          "acao": "Impresso por JUNIOR",
          "hora": 1770472540000
        }
      ]
    },
    {
      "tipo": "OS",
      "numero": "97703",
      "nome": "FABRICIO",
      "vendedor": "ALAN",
      "dataInstalacao": "10/02/2026 - Manhã",
      "observacao": "",
      "status": "em_separacao",
      "criadoEm": "2026-02-07T13:56:44.000Z",
      "historico": [
        {
          "acao": "Criado",
          "hora": 1770472604000
        },
        {
          "acao": "Impresso por JUNIOR",
          "hora": 1770472604000
        }
      ]
    },
    {
      "tipo": "PV",
      "numero": "144853",
      "nome": "Jefferson Artur",
      "vendedor": "Leonardo",
      "dataInstalacao": "07/02/2026 - Manhã",
      "observacao": "",
      "status": "aguardando_retirada",
      "criadoEm": "2026-02-07T13:09:09.000Z",
      "historico": [
        {
          "acao": "Criado",
          "hora": 1770469749000
        },
        {
          "acao": "Impresso por JUNIOR",
          "hora": 1770469749000
        },
        {
          "acao": "Separado por paulo",
          "hora": 1770472518000
        }
      ]
    },
    {
      "tipo": "OS",
      "numero": "97706",
      "nome": "ANDREI",
      "vendedor": "CAROL",
      "dataInstalacao": "19/02/2026 - Manhã",
      "observacao": "",
      "status": "em_separacao",
      "criadoEm": "2026-02-07T13:57:39.000Z",
      "historico": [
        {
          "acao": "Criado",
          "hora": 1770472659000
        },
        {
          "acao": "Impresso por JUNIOR",
          "hora": 1770472659000
        }
      ]
    },
    {
      "tipo": "PV",
      "numero": "144862",
      "nome": "Mundo das Águas",
      "vendedor": "Leonardo",
      "dataInstalacao": "07/02/2026 - Manhã",
      "observacao": "Já está pago. Comprovante com a Sandra.",
      "status": "aguardando_retirada",
      "criadoEm": "2026-02-09T10:21:14.000Z",
      "historico": [
        {
          "acao": "Criado",
          "hora": 1770632474000
        },
        {
          "acao": "Impresso por JUNIOR",
          "hora": 1770632474000
        },
        {
          "acao": "Separado por EDILBERTO",
          "hora": 1770643765000
        }
      ]
    },
    {
      "tipo": "OS",
      "numero": "97717",
      "nome": "HEBRON",
      "vendedor": "MARCELA",
      "dataInstalacao": "13/02/2026 - Manhã",
      "observacao": "",
      "status": "em_separacao",
      "criadoEm": "2026-02-09T10:20:42.000Z",
      "historico": [
        {
          "acao": "Criado",
          "hora": 1770632442000
        },
        {
          "acao": "Impresso por JUNIOR",
          "hora": 1770632442000
        }
      ]
    },
    {
      "tipo": "OS",
      "numero": "97696",
      "nome": "ANDREI",
      "vendedor": "MARCELA",
      "dataInstalacao": "09/02/2026 - Manhã",
      "observacao": "REPOSIÇÃO MALETA, SEPARAR SOMENTE OS ITENS 3584 E 7619, RESTANTE JÁ FOI ENTREGUE",
      "status": "em_separacao",
      "criadoEm": "2026-02-09T11:27:16.000Z",
      "historico": [
        {
          "acao": "Criado",
          "hora": 1770636436000
        },
        {
          "acao": "Impresso por JUNIOR",
          "hora": 1770636436000
        }
      ]
    },
    {
      "tipo": "OS",
      "numero": "97722",
      "nome": "ANDREI",
      "vendedor": "CAROL",
      "dataInstalacao": "09/02/2026 - Manhã",
      "observacao": "",
      "status": "aguardando_retirada",
      "criadoEm": "2026-02-09T11:18:51.000Z",
      "historico": [
        {
          "acao": "Criado",
          "hora": 1770635931000
        },
        {
          "acao": "Impresso por JOAO",
          "hora": 1770635931000
        },
        {
          "acao": "Separado por JOSE",
          "hora": 1770644309000
        }
      ]
    },
    {
      "tipo": "OS",
      "numero": "97709",
      "nome": "FABRICIO",
      "vendedor": "JOCISLAINE",
      "dataInstalacao": "09/02/2026 - Manhã",
      "observacao": "REPOSIÇÃO DA MALETA DO FABRICIO.",
      "status": "aguardando_retirada",
      "criadoEm": "2026-02-09T11:39:58.000Z",
      "historico": [
        {
          "acao": "Criado",
          "hora": 1770637198000
        },
        {
          "acao": "Impresso por JUNIOR",
          "hora": 1770637198000
        },
        {
          "acao": "Separado por JOAO",
          "hora": 1770723468172
        }
      ]
    },
    {
      "tipo": "OS",
      "numero": "97742",
      "nome": "ANDREI",
      "vendedor": "CAROL",
      "dataInstalacao": "09/02/2026 - Manhã",
      "observacao": "TECNICO ESTA VINDO NA LOJA RETIRAR",
      "status": "em_separacao",
      "criadoEm": "2026-02-09T13:26:05.000Z",
      "historico": [
        {
          "acao": "Criado",
          "hora": 1770643565000
        },
        {
          "acao": "Impresso por EDILBERTO",
          "hora": 1770643565000
        }
      ]
    },
    {
      "tipo": "PV",
      "numero": "144910",
      "nome": "Ale Aquecedores",
      "vendedor": "Leonardo",
      "dataInstalacao": "09/02/2026 - Manhã",
      "observacao": "",
      "status": "aguardando_retirada",
      "criadoEm": "2026-02-09T13:27:42.000Z",
      "historico": [
        {
          "acao": "Criado",
          "hora": 1770643662000
        },
        {
          "acao": "Impresso por EDILBERTO",
          "hora": 1770643662000
        },
        {
          "acao": "Separado por JOSE",
          "hora": 1770723997995
        }
      ]
    },
    {
      "tipo": "PV",
      "numero": "2300",
      "nome": "TECGAZ",
      "vendedor": "FABIANO",
      "dataInstalacao": "10/02/2026 - Manha",
      "observacao": "CLIENTE VEM RETIRAR",
      "status": "aguardando_retirada",
      "criadoEm": "2026-02-10T11:38:23.036Z",
      "historico": [
        {
          "acao": "Criado",
          "hora": 1770723503036
        },
        {
          "acao": "Impresso por JUNIOR",
          "hora": 1770725954188
        },
        {
          "acao": "Separado por JUNIOR",
          "hora": 1770725965772
        }
      ]
    },
    {
      "tipo": "PV",
      "numero": "144976",
      "nome": "ADIR",
      "vendedor": "LEO ASS",
      "dataInstalacao": "10/02/2026 - Manha",
      "observacao": "",
      "status": "aguardando_retirada",
      "criadoEm": "2026-02-10T11:38:25.178Z",
      "historico": [
        {
          "acao": "Criado",
          "hora": 1770723505178
        },
        {
          "acao": "Impresso por JOSE",
          "hora": 1770723515964
        },
        {
          "acao": "Separado por JOSE",
          "hora": 1770723526020
        }
      ]
    },
    {
      "tipo": "PV",
      "numero": "2295",
      "nome": "CASA DO GAS",
      "vendedor": "LEONARDO",
      "dataInstalacao": "",
      "observacao": "",
      "status": "aguardando_retirada",
      "criadoEm": "2026-02-10T11:43:29.587Z",
      "historico": [
        {
          "acao": "Criado",
          "hora": 1770723809587
        },
        {
          "acao": "Impresso por JUNIOR",
          "hora": 1770725977084
        },
        {
          "acao": "Separado por JUNIOR",
          "hora": 1770725982508
        }
      ]
    },
    {
      "tipo": "PV",
      "numero": "144968",
      "nome": "CASA DO GAS",
      "vendedor": "LEONARDO",
      "dataInstalacao": "",
      "observacao": "",
      "status": "aguardando_retirada",
      "criadoEm": "2026-02-10T11:43:57.236Z",
      "historico": [
        {
          "acao": "Criado",
          "hora": 1770723837236
        },
        {
          "acao": "Impresso por JUNIOR",
          "hora": 1770725990932
        },
        {
          "acao": "Separado por JUNIOR",
          "hora": 1770725995940
        }
      ]
    },
    {
      "tipo": "PV",
      "numero": "144949",
      "nome": "DFRANÇA",
      "vendedor": "LEONARDO",
      "dataInstalacao": "",
      "observacao": "",
      "status": "aguardando_retirada",
      "criadoEm": "2026-02-10T11:45:32.652Z",
      "historico": [
        {
          "acao": "Criado",
          "hora": 1770723932652
        },
        {
          "acao": "Impresso por JUNIOR",
          "hora": 1770726004044
        },
        {
          "acao": "Separado por JUNIOR",
          "hora": 1770726009540
        }
      ]
    },
    {
      "tipo": "OS",
      "numero": "97790",
      "nome": "HEBRON",
      "vendedor": "TIAGO TROJAN",
      "dataInstalacao": "11/02/2026 - Tarde",
      "observacao": "HEBRON GERALMENTE RETIRA TODOS OS MATERIAIS CEDO -",
      "status": "aguardando_retirada",
      "criadoEm": "2026-02-10T11:46:14.601Z",
      "historico": [
        {
          "acao": "Criado",
          "hora": 1770723974601
        },
        {
          "acao": "Impresso por JUNIOR",
          "hora": 1770726102084
        },
        {
          "acao": "Separado por JOSE",
          "hora": 1770728637475
        }
      ]
    },
    {
      "tipo": "OS",
      "numero": "97799",
      "nome": "ANDREI",
      "vendedor": "CAROLINE",
      "dataInstalacao": "10/02/2026 - Manha",
      "observacao": "",
      "status": "aguardando_retirada",
      "criadoEm": "2026-02-10T12:07:58.747Z",
      "historico": [
        {
          "acao": "Criado",
          "hora": 1770725278747
        },
        {
          "acao": "Impresso por JOSE",
          "hora": 1770725317977
        },
        {
          "acao": "Separado por JOSE",
          "hora": 1770725326657
        }
      ]
    },
    {
      "tipo": "OS",
      "numero": "97759",
      "nome": "MARCIO",
      "vendedor": "ALAN ROBSON",
      "dataInstalacao": "10/02/2026 - Manha",
      "observacao": "↺ Reentrado em 10/02/2026, 09:48:20: FINALIZADO ERRADO",
      "status": "aguardando_retirada",
      "criadoEm": "2026-02-10T12:39:05.008Z",
      "historico": [
        {
          "acao": "Criado",
          "hora": 1770727145008
        },
        {
          "acao": "Impresso por JOSE",
          "hora": 1770727168548
        },
        {
          "acao": "Separado por JOSE",
          "hora": 1770727179428
        },
        {
          "acao": "Retirado por MARCIO, conferido por JOAO",
          "hora": 1770727650196
        },
        {
          "acao": "Reentrado para IMPRESSAO - Motivo: FINALIZADO ERRADO",
          "hora": 1770727700604
        },
        {
          "acao": "Impresso por JOAO",
          "hora": 1770727711492
        },
        {
          "acao": "Separado por JUNIOR",
          "hora": 1770727722731
        }
      ],
      "finalizadoEm": null,
      "reentrado": true,
      "updatedAt": 1770727700619
    },
    {
      "tipo": "OS",
      "numero": "97786",
      "nome": "TIAGO",
      "vendedor": "TIAGO TROJAN",
      "dataInstalacao": "10/12/2026 - Manha",
      "observacao": "",
      "status": "finalizados",
      "criadoEm": "2026-02-10T12:39:21.777Z",
      "historico": [
        {
          "acao": "Criado",
          "hora": 1770727161777
        },
        {
          "acao": "Impresso por PAULO",
          "hora": 1770727170431
        },
        {
          "acao": "Separado por PAULO",
          "hora": 1770727181447
        },
        {
          "acao": "Retirado por tiago, conferido por JOAO",
          "hora": 1770737553771
        }
      ]
    },
    {
      "tipo": "OS",
      "numero": "97835",
      "nome": "HEBRON",
      "vendedor": "MARCELA",
      "dataInstalacao": "13/02/2026 - Tarde",
      "observacao": "",
      "status": "em_separacao",
      "criadoEm": "2026-02-10T13:08:03.794Z",
      "historico": [
        {
          "acao": "Criado",
          "hora": 1770728883794
        },
        {
          "acao": "Impresso por JUNIOR",
          "hora": 1770733969181
        }
      ]
    },
    {
      "tipo": "OS",
      "numero": "97593",
      "nome": "FABRICIO",
      "vendedor": "TIAGO TROJAN",
      "dataInstalacao": "14/02/2026 - Manha",
      "observacao": "",
      "status": "em_separacao",
      "criadoEm": "2026-02-10T13:35:18.147Z",
      "historico": [
        {
          "acao": "Criado",
          "hora": 1770730518147
        },
        {
          "acao": "Impresso por JUNIOR",
          "hora": 1770734413725
        }
      ]
    },
    {
      "tipo": "PV",
      "numero": "145000",
      "nome": "Supra Gás",
      "vendedor": "Leonardo",
      "dataInstalacao": "10/02/2026 - Manha",
      "observacao": "",
      "status": "aguardando_retirada",
      "criadoEm": "2026-02-10T13:41:09.443Z",
      "historico": [
        {
          "acao": "Criado",
          "hora": 1770730869443
        },
        {
          "acao": "Impresso por FIGUEIREDO",
          "hora": 1770733753747
        },
        {
          "acao": "Separado por FIGUEIREDO",
          "hora": 1770734211629
        }
      ]
    },
    {
      "tipo": "PV",
      "numero": "144966",
      "nome": "Phillip Rodrigues",
      "vendedor": "Leonardo",
      "dataInstalacao": "10/02/2026 - Tarde",
      "observacao": "",
      "status": "em_separacao",
      "criadoEm": "2026-02-10T13:43:47.570Z",
      "historico": [
        {
          "acao": "Criado",
          "hora": 1770731027570
        },
        {
          "acao": "Impresso por FIGUEIREDO",
          "hora": 1770733821160
        }
      ]
    },
    {
      "tipo": "OS",
      "numero": "97844",
      "nome": "Roger",
      "vendedor": "Andressa",
      "dataInstalacao": "10/02/2026 - Manha",
      "observacao": "",
      "status": "aguardando_retirada",
      "criadoEm": "2026-02-10T14:02:33.746Z",
      "historico": [
        {
          "acao": "Criado",
          "hora": 1770732153746
        },
        {
          "acao": "Impresso por PAULO",
          "hora": 1770732387910
        },
        {
          "acao": "Separado por PAULO",
          "hora": 1770732392870
        }
      ]
    },
    {
      "tipo": "OS",
      "numero": "97851",
      "nome": "VINICIUS",
      "vendedor": "DEBORA",
      "dataInstalacao": "11/02/2026 - Manha",
      "observacao": "",
      "status": "em_separacao",
      "criadoEm": "2026-02-10T14:12:29.534Z",
      "historico": [
        {
          "acao": "Criado",
          "hora": 1770732749534
        },
        {
          "acao": "Impresso por JUNIOR",
          "hora": 1770734470589
        }
      ]
    },
    {
      "tipo": "OS",
      "numero": "95984",
      "nome": "HENRIQUE",
      "vendedor": "ALAN",
      "dataInstalacao": "11/02/2026 - Manha",
      "observacao": "",
      "status": "aguardando_retirada",
      "criadoEm": "2026-02-10T15:35:25.572Z",
      "historico": [
        {
          "acao": "Criado",
          "hora": 1770737725572
        },
        {
          "acao": "Impresso por FIGUEIREDO",
          "hora": 1770737734191
        },
        {
          "acao": "Separado por FIGUEIREDO",
          "hora": 1770737744078
        }
      ]
    }
  ],
  "historicoFinalizados": [
    {
      "tipo": "OS",
      "numero": "97784",
      "nome": "hebron",
      "vendedor": "andressa",
      "dataInstalacao": "10/02/2026 - Manha",
      "observacao": "",
      "status": "finalizados",
      "criadoEm": "2026-02-10T11:09:14.714Z",
      "historico": [
        {
          "acao": "Criado",
          "hora": 1770721754714
        },
        {
          "acao": "Impresso por JUNIOR",
          "hora": 1770721775684
        },
        {
          "acao": "Separado por JUNIOR",
          "hora": 1770721802308
        },
        {
          "acao": "Retirado por hebron, conferido por JUNIOR",
          "hora": 1770721811556
        }
      ]
    },
    {
      "tipo": "OS",
      "numero": "97818",
      "nome": "hebron",
      "vendedor": "jo",
      "dataInstalacao": "10/02/2026 - Manha",
      "observacao": "",
      "status": "finalizados",
      "criadoEm": "2026-02-10T11:10:41.907Z",
      "historico": [
        {
          "acao": "Criado",
          "hora": 1770721841907
        },
        {
          "acao": "Impresso por JUNIOR",
          "hora": 1770721847308
        },
        {
          "acao": "Separado por JUNIOR",
          "hora": 1770721852532
        },
        {
          "acao": "Retirado por hebron, conferido por JUNIOR",
          "hora": 1770721861084
        }
      ]
    },
    {
      "tipo": "OS",
      "numero": "97756",
      "nome": "hebron",
      "vendedor": "debora",
      "dataInstalacao": "10/02/2026 - Manha",
      "observacao": "",
      "status": "finalizados",
      "criadoEm": "2026-02-10T10:40:22.285Z",
      "historico": [
        {
          "acao": "Criado",
          "hora": 1770720022285
        },
        {
          "acao": "Impresso por JUNIOR",
          "hora": 1770722345364
        },
        {
          "acao": "Separado por JUNIOR",
          "hora": 1770722352652
        },
        {
          "acao": "Retirado por hebron, conferido por JUNIOR",
          "hora": 1770722360932
        }
      ]
    },
    {
      "tipo": "OS",
      "numero": "97770",
      "nome": "hebron",
      "vendedor": "andressa",
      "dataInstalacao": "10/02/2026 - Manha",
      "observacao": "",
      "status": "finalizados",
      "criadoEm": "2026-02-10T11:19:44.940Z",
      "historico": [
        {
          "acao": "Criado",
          "hora": 1770722384940
        },
        {
          "acao": "Impresso por JUNIOR",
          "hora": 1770722389948
        },
        {
          "acao": "Separado por JUNIOR",
          "hora": 1770722394620
        },
        {
          "acao": "Retirado por hebron, conferido por JUNIOR",
          "hora": 1770722402348
        }
      ]
    },
    {
      "tipo": "PV",
      "numero": "2299",
      "nome": "EVANDRO BRAGA",
      "vendedor": "FABIANO",
      "dataInstalacao": "09/02/2026 - Manha",
      "observacao": "CLIENTE RETIRA CEDO",
      "status": "finalizados",
      "criadoEm": "2026-02-09T21:55:13.600Z",
      "historico": [
        {
          "acao": "Criado",
          "hora": 1770674113600
        },
        {
          "acao": "Impresso por JUNIOR",
          "hora": 1770719328252
        },
        {
          "acao": "Separado por BRUNO",
          "hora": 1770722703188
        },
        {
          "acao": "Retirado por EVANDRO, conferido por BRUNO",
          "hora": 1770722718940
        }
      ]
    },
    {
      "tipo": "OS",
      "numero": "89659 - ULTIMO ITEM ENTREGAR AO TECNICO",
      "nome": "FABRICIO",
      "vendedor": "ALAN",
      "dataInstalacao": "14/01/2026 - Manhã",
      "observacao": "",
      "status": "finalizados",
      "criadoEm": "2026-01-13T11:59:27.000Z",
      "historico": [
        {
          "acao": "Criado",
          "hora": 1768305567000
        },
        {
          "acao": "Impresso por JUNIOR",
          "hora": 1768319324000
        },
        {
          "acao": "Separado por FIGUEIREDO",
          "hora": 1768334618000
        },
        {
          "acao": "Retirado por FABRICIO, conferido por JOAO",
          "hora": 1768477529000
        }
      ]
    },
    {
      "tipo": "PV",
      "numero": "2181",
      "nome": "Evandro Braga",
      "vendedor": "LEONARDO",
      "dataInstalacao": "12/01/2026 - Manhã",
      "observacao": "",
      "status": "finalizados",
      "criadoEm": "2026-01-12T12:04:45.000Z",
      "historico": [
        {
          "acao": "Criado",
          "hora": 1768219485000
        },
        {
          "acao": "Impresso por PAULO",
          "hora": 1768221239000
        },
        {
          "acao": "Separado por PAULO",
          "hora": 1768221244000
        },
        {
          "acao": "Retirado por TUCA, conferido por JOAO",
          "hora": 1768403742000
        }
      ]
    },
    {
      "tipo": "OS",
      "numero": "96313",
      "nome": "VINICIUS",
      "vendedor": "ALAN",
      "dataInstalacao": "16/01/2026 - Manhã",
      "observacao": "",
      "status": "finalizados",
      "criadoEm": "2026-01-08T16:39:11.000Z",
      "historico": [
        {
          "acao": "Criado",
          "hora": 1767890351000
        },
        {
          "acao": "Impresso por ADRIANO",
          "hora": 1767891196000
        },
        {
          "acao": "Separado por JUNIOR",
          "hora": 1768575577000
        },
        {
          "acao": "Retirado por VINICIUS, conferido por JOAO",
          "hora": 1768575589000
        }
      ]
    },
    {
      "tipo": "OS",
      "numero": "96696",
      "nome": "TIAGO",
      "vendedor": "LUIZ",
      "dataInstalacao": "17/01/2026 - Manhã",
      "observacao": "",
      "status": "finalizados",
      "criadoEm": "2026-01-16T11:53:44.000Z",
      "historico": [
        {
          "acao": "Criado",
          "hora": 1768564424000
        },
        {
          "acao": "Impresso por JOAO",
          "hora": 1768566521000
        },
        {
          "acao": "Separado por JOAO",
          "hora": 1768591255000
        },
        {
          "acao": "Retirado por TIAGO, conferido por ADRIANO",
          "hora": 1769085468000
        }
      ]
    },
    {
      "tipo": "OS",
      "numero": "97368",
      "nome": "ALEXANDRE",
      "vendedor": "ADRIANO",
      "dataInstalacao": "05/02/2026 - Tarde",
      "observacao": "",
      "status": "finalizados",
      "criadoEm": "2026-02-05T16:20:26.000Z",
      "historico": [
        {
          "acao": "Criado",
          "hora": 1770308426000
        },
        {
          "acao": "Impresso por ADRIANO",
          "hora": 1770308436000
        },
        {
          "acao": "Separado por ADRIANO",
          "hora": 1770308449000
        },
        {
          "acao": "Retirado por ALEXANDRE, conferido por ADRIANO",
          "hora": 1770308484000
        }
      ]
    },
    {
      "tipo": "OS",
      "numero": "97314",
      "nome": "FABRICIO",
      "vendedor": "ADRIANO",
      "dataInstalacao": "",
      "observacao": "",
      "status": "finalizados",
      "criadoEm": "2026-01-31T13:47:16.000Z",
      "historico": [
        {
          "acao": "Criado",
          "hora": 1769867236000
        },
        {
          "acao": "Impresso por ADRIANO",
          "hora": 1769867256000
        },
        {
          "acao": "Separado por ADRIANO",
          "hora": 1769867268000
        },
        {
          "acao": "Retirado por FABRICIO, conferido por ADRIANO",
          "hora": 1770306100000
        }
      ]
    },
    {
      "tipo": "OS",
      "numero": "97303",
      "nome": "FAbricio",
      "vendedor": "ADRIANO",
      "dataInstalacao": "",
      "observacao": "",
      "status": "finalizados",
      "criadoEm": "2026-01-31T13:49:25.000Z",
      "historico": [
        {
          "acao": "Criado",
          "hora": 1769867365000
        },
        {
          "acao": "Impresso por ADRIANO",
          "hora": 1769867375000
        },
        {
          "acao": "Separado por ADRIANO",
          "hora": 1769867408000
        },
        {
          "acao": "Retirado por FABRICIO, conferido por ADRIANO",
          "hora": 1770306095000
        }
      ]
    },
    {
      "tipo": "OS",
      "numero": "96800",
      "nome": "REGINALDO",
      "vendedor": "ANDRESSA",
      "dataInstalacao": "19/01/2026 - Tarde",
      "observacao": "",
      "status": "finalizados",
      "criadoEm": "2026-01-19T16:13:52.000Z",
      "historico": [
        {
          "acao": "Criado",
          "hora": 1768839232000
        },
        {
          "acao": "Impresso por ADRIANO",
          "hora": 1768839450000
        },
        {
          "acao": "Separado por ADRIANO",
          "hora": 1768839467000
        },
        {
          "acao": "Retirado por REGINALDO, conferido por ADRIANO",
          "hora": 1768839481000
        }
      ]
    },
    {
      "tipo": "OS",
      "numero": "97356",
      "nome": "FABRICIO",
      "vendedor": "CAROL",
      "dataInstalacao": "",
      "observacao": "",
      "status": "finalizados",
      "criadoEm": "2026-02-02T16:15:26.000Z",
      "historico": [
        {
          "acao": "Criado",
          "hora": 1770048926000
        },
        {
          "acao": "Impresso por ADRIANO",
          "hora": 1770048937000
        },
        {
          "acao": "Separado por ADRIANO",
          "hora": 1770048947000
        },
        {
          "acao": "Retirado por FABRICIO, conferido por ADRIANO",
          "hora": 1770048961000
        }
      ]
    },
    {
      "tipo": "OS",
      "numero": "97170",
      "nome": "HENRIQUE",
      "vendedor": "CAROL",
      "dataInstalacao": "26/01/2026 - Tarde",
      "observacao": "",
      "status": "finalizados",
      "criadoEm": "2026-01-26T16:18:42.000Z",
      "historico": [
        {
          "acao": "Criado",
          "hora": 1769444322000
        },
        {
          "acao": "Impresso por ADRIANO",
          "hora": 1769446448000
        },
        {
          "acao": "Separado por ADRIANO",
          "hora": 1769448275000
        },
        {
          "acao": "Retirado por HENRIQUE, conferido por ADRIANO",
          "hora": 1769448291000
        }
      ]
    },
    {
      "tipo": "PV",
      "numero": "142859",
      "nome": "Simone Cristine Mancera Marques Januario",
      "vendedor": "CAROL",
      "dataInstalacao": "08/01/2026 - Manhã",
      "observacao": "",
      "status": "finalizados",
      "criadoEm": "2026-01-08T14:25:50.000Z",
      "historico": [
        {
          "acao": "Criado",
          "hora": 1767882350000
        },
        {
          "acao": "Impresso por ADRIANO",
          "hora": 1767886922000
        },
        {
          "acao": "Separado por ADRIANO",
          "hora": 1767887763000
        },
        {
          "acao": "Retirado por VANDERLI, conferido por ADRIANO",
          "hora": 1767897297000
        }
      ]
    },
    {
      "tipo": "OS",
      "numero": "96885",
      "nome": "TIAGO",
      "vendedor": "MARCELA",
      "dataInstalacao": "20/01/2026 - Tarde",
      "observacao": "",
      "status": "finalizados",
      "criadoEm": "2026-01-20T16:17:52.000Z",
      "historico": [
        {
          "acao": "Criado",
          "hora": 1768925872000
        },
        {
          "acao": "Impresso por ADRIANO",
          "hora": 1768926113000
        },
        {
          "acao": "Separado por ADRIANO",
          "hora": 1768926145000
        },
        {
          "acao": "Retirado por TIAGO, conferido por ADRIANO",
          "hora": 1768926166000
        }
      ]
    },
    {
      "tipo": "OS",
      "numero": "96795",
      "nome": "VINICIUS",
      "vendedor": "MARCELA",
      "dataInstalacao": "19/01/2026 - Tarde",
      "observacao": "",
      "status": "finalizados",
      "criadoEm": "2026-01-19T15:33:25.000Z",
      "historico": [
        {
          "acao": "Criado",
          "hora": 1768836805000
        },
        {
          "acao": "Impresso por ADRIANO",
          "hora": 1768837019000
        },
        {
          "acao": "Separado por ADRIANO",
          "hora": 1768837033000
        },
        {
          "acao": "Retirado por VINICIUS, conferido por ADRIANO",
          "hora": 1768837047000
        }
      ]
    },
    {
      "tipo": "OS",
      "numero": "96399",
      "nome": "REGINALDO",
      "vendedor": "MARCELA",
      "dataInstalacao": "12/01/2026 - Manhã",
      "observacao": "",
      "status": "finalizados",
      "criadoEm": "2026-01-10T14:30:36.000Z",
      "historico": [
        {
          "acao": "Criado",
          "hora": 1768055436000
        },
        {
          "acao": "Impresso por ADRIANO",
          "hora": 1768223795000
        },
        {
          "acao": "Separado por ADRIANO",
          "hora": 1768223801000
        },
        {
          "acao": "Retirado por REGINALDO, conferido por ADRIANO",
          "hora": 1768223812000
        }
      ]
    },
    {
      "tipo": "OS",
      "numero": "96332",
      "nome": "MODENA",
      "vendedor": "MARCELA",
      "dataInstalacao": "10/01/2026 - Manhã",
      "observacao": "",
      "status": "finalizados",
      "criadoEm": "2026-01-10T11:58:45.000Z",
      "historico": [
        {
          "acao": "Criado",
          "hora": 1768046325000
        },
        {
          "acao": "Impresso por ADRIANO",
          "hora": 1768048862000
        },
        {
          "acao": "Separado por ADRIANO",
          "hora": 1768048870000
        },
        {
          "acao": "Retirado por MODENA, conferido por ADRIANO",
          "hora": 1768048880000
        }
      ]
    },
    {
      "tipo": "OS",
      "numero": "97305",
      "nome": "FABRICIO",
      "vendedor": "DEBORA",
      "dataInstalacao": "",
      "observacao": "",
      "status": "finalizados",
      "criadoEm": "2026-02-02T16:14:06.000Z",
      "historico": [
        {
          "acao": "Criado",
          "hora": 1770048846000
        },
        {
          "acao": "Impresso por ADRIANO",
          "hora": 1770048859000
        },
        {
          "acao": "Separado por ADRIANO",
          "hora": 1770048869000
        },
        {
          "acao": "Retirado por FABRICIO, conferido por ADRIANO",
          "hora": 1770048889000
        }
      ]
    },
    {
      "tipo": "PV",
      "numero": "144336",
      "nome": "HIDRALGAS",
      "vendedor": "FABIANO",
      "dataInstalacao": "30/01/2026 - Manhã",
      "observacao": "",
      "status": "finalizados",
      "criadoEm": "2026-01-30T16:27:49.000Z",
      "historico": [
        {
          "acao": "Criado",
          "hora": 1769790469000
        },
        {
          "acao": "Impresso por FABIANO",
          "hora": 1769790478000
        },
        {
          "acao": "Separado por ADRIANO",
          "hora": 1769790510000
        },
        {
          "acao": "Retirado por RAFAEL, conferido por ADRIANO",
          "hora": 1769790533000
        }
      ]
    },
    {
      "tipo": "PV",
      "numero": "144244",
      "nome": "Clayton Mendes",
      "vendedor": "LEONARDO",
      "dataInstalacao": "29/01/2026 - Manhã",
      "observacao": "",
      "status": "finalizados",
      "criadoEm": "2026-01-29T14:33:17.000Z",
      "historico": [
        {
          "acao": "Criado",
          "hora": 1769697197000
        },
        {
          "acao": "Impresso por JOAO",
          "hora": 1769697325000
        },
        {
          "acao": "Separado por ADRIANO",
          "hora": 1769697331000
        },
        {
          "acao": "Retirado por CLAYTON, conferido por ADRIANO",
          "hora": 1769697949000
        }
      ]
    },
    {
      "tipo": "OS",
      "numero": "94025",
      "nome": "TIAGO",
      "vendedor": "ALAN",
      "dataInstalacao": "26/01/2026 - Tarde",
      "observacao": "",
      "status": "finalizados",
      "criadoEm": "2026-01-23T17:02:02.000Z",
      "historico": [
        {
          "acao": "Criado",
          "hora": 1769187722000
        },
        {
          "acao": "Impresso por JUNIOR",
          "hora": 1769197513000
        },
        {
          "acao": "Separado por ADRIANO",
          "hora": 1769448242000
        },
        {
          "acao": "Retirado por TIAGO, conferido por ADRIANO",
          "hora": 1769448252000
        }
      ]
    },
    {
      "tipo": "OS",
      "numero": "89707",
      "nome": "VINICIUS",
      "vendedor": "AMAURY",
      "dataInstalacao": "",
      "observacao": "",
      "status": "finalizados",
      "criadoEm": "2026-01-22T18:09:48.000Z",
      "historico": [
        {
          "acao": "Criado",
          "hora": 1769105388000
        },
        {
          "acao": "Impresso por S/DADOS",
          "hora": 1769105399000
        },
        {
          "acao": "Separado por JUNIOR",
          "hora": 1769105406000
        },
        {
          "acao": "Retirado por VINICIUS, conferido por ADRIANO",
          "hora": 1769105437000
        }
      ]
    },
    {
      "tipo": "OS",
      "numero": "97325",
      "nome": "bruno",
      "vendedor": "CAROL",
      "dataInstalacao": "29/01/2026 - Manhã",
      "observacao": "",
      "status": "finalizados",
      "criadoEm": "2026-01-29T14:36:47.000Z",
      "historico": [
        {
          "acao": "Criado",
          "hora": 1769697407000
        },
        {
          "acao": "Impresso por JUNIOR",
          "hora": 1769698131000
        },
        {
          "acao": "Separado por ADRIANO",
          "hora": 1769702096000
        },
        {
          "acao": "Retirado por BRUNO, conferido por ADRIANO",
          "hora": 1769702108000
        }
      ]
    },
    {
      "tipo": "OS",
      "numero": "96357",
      "nome": "REGINALDO",
      "vendedor": "CAROL",
      "dataInstalacao": "12/01/2026 - Manhã",
      "observacao": "",
      "status": "finalizados",
      "criadoEm": "2026-01-09T15:19:01.000Z",
      "historico": [
        {
          "acao": "Criado",
          "hora": 1767971941000
        },
        {
          "acao": "Impresso por JUNIOR",
          "hora": 1767972145000
        },
        {
          "acao": "Separado por ADRIANO",
          "hora": 1768052678000
        },
        {
          "acao": "Retirado por REGINALDO, conferido por ADRIANO",
          "hora": 1768403345000
        }
      ]
    },
    {
      "tipo": "PV",
      "numero": "143867",
      "nome": "GABRIEL",
      "vendedor": "FABIANO",
      "dataInstalacao": "24/01/2026 - Manhã",
      "observacao": "",
      "status": "finalizados",
      "criadoEm": "2026-01-24T12:02:53.000Z",
      "historico": [
        {
          "acao": "Criado",
          "hora": 1769256173000
        },
        {
          "acao": "Impresso por JUNIOR",
          "hora": 1769256180000
        },
        {
          "acao": "Separado por ADRIANO",
          "hora": 1769256196000
        },
        {
          "acao": "Retirado por GABRIEL, conferido por ADRIANO",
          "hora": 1769256209000
        }
      ]
    },
    {
      "tipo": "OS",
      "numero": "94096",
      "nome": "Roger",
      "vendedor": "FELIPE",
      "dataInstalacao": "22/01/2026 - Tarde",
      "observacao": "",
      "status": "finalizados",
      "criadoEm": "2026-01-21T13:20:03.000Z",
      "historico": [
        {
          "acao": "Criado",
          "hora": 1769001603000
        },
        {
          "acao": "Impresso por JUNIOR",
          "hora": 1769003150000
        },
        {
          "acao": "Separado por ADRIANO",
          "hora": 1769192820000
        },
        {
          "acao": "Retirado por ROGER, conferido por ADRIANO",
          "hora": 1769192837000
        }
      ]
    },
    {
      "tipo": "OS",
      "numero": "97111",
      "nome": "ROGER",
      "vendedor": "JOCISLAINE",
      "dataInstalacao": "26/01/2026 - Tarde",
      "observacao": "",
      "status": "finalizados",
      "criadoEm": "2026-01-24T10:59:17.000Z",
      "historico": [
        {
          "acao": "Criado",
          "hora": 1769252357000
        },
        {
          "acao": "Impresso por JUNIOR",
          "hora": 1769252904000
        },
        {
          "acao": "Separado por ADRIANO",
          "hora": 1769444603000
        },
        {
          "acao": "Retirado por ROGER, conferido por ADRIANO",
          "hora": 1769444617000
        }
      ]
    },
    {
      "tipo": "OS",
      "numero": "96345",
      "nome": "ANDREI",
      "vendedor": "MARCELA",
      "dataInstalacao": "12/01/2026 - Manhã",
      "observacao": "",
      "status": "finalizados",
      "criadoEm": "2026-01-09T12:33:41.000Z",
      "historico": [
        {
          "acao": "Criado",
          "hora": 1767962021000
        },
        {
          "acao": "Impresso por JUNIOR",
          "hora": 1767971301000
        },
        {
          "acao": "Separado por ADRIANO",
          "hora": 1768230778000
        },
        {
          "acao": "Retirado por ANDREI, conferido por ADRIANO",
          "hora": 1768230788000
        }
      ]
    },
    {
      "tipo": "OS",
      "numero": "94835",
      "nome": "REGINALDO",
      "vendedor": "ALAN",
      "dataInstalacao": "02/02/2026 - Manhã",
      "observacao": "",
      "status": "finalizados",
      "criadoEm": "2026-01-30T17:19:34.000Z",
      "historico": [
        {
          "acao": "Criado",
          "hora": 1769793574000
        },
        {
          "acao": "Impresso por PAULO",
          "hora": 1769805096000
        },
        {
          "acao": "Separado por ADRIANO",
          "hora": 1770055609000
        },
        {
          "acao": "Retirado por ADRIANO, conferido por ADRIANO",
          "hora": 1770055624000
        }
      ]
    },
    {
      "tipo": "OS",
      "numero": "97129",
      "nome": "TIAGO",
      "vendedor": "ALAN",
      "dataInstalacao": "30/01/2026 - Manhã",
      "observacao": "",
      "status": "finalizados",
      "criadoEm": "2026-01-29T11:16:35.000Z",
      "historico": [
        {
          "acao": "Criado",
          "hora": 1769685395000
        },
        {
          "acao": "Impresso por PAULO",
          "hora": 1769695636000
        },
        {
          "acao": "Separado por ADRIANO",
          "hora": 1769857833000
        },
        {
          "acao": "Retirado por TIAGO, conferido por ADRIANO",
          "hora": 1769857854000
        }
      ]
    },
    {
      "tipo": "OS",
      "numero": "97313",
      "nome": "BRUNO",
      "vendedor": "ALAN",
      "dataInstalacao": "29/01/2026 - Tarde",
      "observacao": "",
      "status": "finalizados",
      "criadoEm": "2026-01-29T12:09:59.000Z",
      "historico": [
        {
          "acao": "Criado",
          "hora": 1769688599000
        },
        {
          "acao": "Impresso por PAULO",
          "hora": 1769695794000
        },
        {
          "acao": "Separado por ADRIANO",
          "hora": 1769702047000
        },
        {
          "acao": "Retirado por BRUNO, conferido por ADRIANO",
          "hora": 1769702058000
        }
      ]
    },
    {
      "tipo": "PV",
      "numero": "143290",
      "nome": "ADRIANO (ENTREGA)",
      "vendedor": "ALAN",
      "dataInstalacao": "16/01/2026 - Manhã",
      "observacao": "",
      "status": "finalizados",
      "criadoEm": "2026-01-15T18:42:52.000Z",
      "historico": [
        {
          "acao": "Criado",
          "hora": 1768502572000
        },
        {
          "acao": "Impresso por PAULO",
          "hora": 1768503687000
        },
        {
          "acao": "Separado por ADRIANO",
          "hora": 1768928690000
        },
        {
          "acao": "Retirado por MARCELA, conferido por ADRIANO",
          "hora": 1768928716000
        }
      ]
    },
    {
      "tipo": "PV",
      "numero": "2185",
      "nome": "Casa do Gás",
      "vendedor": "LEONARDO",
      "dataInstalacao": "13/01/2026 - Tarde",
      "observacao": "",
      "status": "finalizados",
      "criadoEm": "2026-01-13T11:40:05.000Z",
      "historico": [
        {
          "acao": "Criado",
          "hora": 1768304405000
        },
        {
          "acao": "Impresso por PAULO",
          "hora": 1768305216000
        },
        {
          "acao": "Separado por ADRIANO",
          "hora": 1768422435000
        },
        {
          "acao": "Retirado por CASA DO GAS, conferido por ADRIANO",
          "hora": 1768422447000
        }
      ]
    },
    {
      "tipo": "OS",
      "numero": "94144",
      "nome": "reginaldo",
      "vendedor": "FELIPE",
      "dataInstalacao": "02/02/2026 - Manhã",
      "observacao": "",
      "status": "finalizados",
      "criadoEm": "2026-01-31T11:00:24.000Z",
      "historico": [
        {
          "acao": "Criado",
          "hora": 1769857224000
        },
        {
          "acao": "Impresso por JOAO",
          "hora": 1769857549000
        },
        {
          "acao": "Separado por JUNIOR",
          "hora": 1770062265000
        },
        {
          "acao": "Retirado por REGINALDO, conferido por ADRIANO",
          "hora": 1770151716000
        }
      ]
    },
    {
      "tipo": "PV",
      "numero": "143427",
      "nome": "D.F.R Sistemas",
      "vendedor": "LEONARDO",
      "dataInstalacao": "20/01/2026 - Manhã",
      "observacao": "",
      "status": "finalizados",
      "criadoEm": "2026-01-19T20:37:26.000Z",
      "historico": [
        {
          "acao": "Criado",
          "hora": 1768855046000
        },
        {
          "acao": "Impresso por PAULO",
          "hora": 1768855312000
        },
        {
          "acao": "Separado por FABIANO",
          "hora": 1769187835000
        },
        {
          "acao": "Retirado por ADRIANO, conferido por ADRIANO",
          "hora": 1769187879000
        }
      ]
    },
    {
      "tipo": "OS",
      "numero": "97397",
      "nome": "fabricio",
      "vendedor": "DEBORA",
      "dataInstalacao": "31/01/2026 - Manhã",
      "observacao": "",
      "status": "finalizados",
      "criadoEm": "2026-01-30T20:52:46.000Z",
      "historico": [
        {
          "acao": "Criado",
          "hora": 1769806366000
        },
        {
          "acao": "Impresso por FIGUEIREDO",
          "hora": 1769856071000
        },
        {
          "acao": "Separado por FIGUEIREDO",
          "hora": 1769857208000
        },
        {
          "acao": "Retirado por FABRICIO, conferido por ADRIANO",
          "hora": 1769866007000
        }
      ]
    },
    {
      "tipo": "OS",
      "numero": "97104",
      "nome": "BRUNO",
      "vendedor": "LUIZ",
      "dataInstalacao": "03/02/2026 - Manhã",
      "observacao": "",
      "status": "finalizados",
      "criadoEm": "2026-02-02T18:13:20.000Z",
      "historico": [
        {
          "acao": "Criado",
          "hora": 1770056000000
        },
        {
          "acao": "Impresso por FABIANO",
          "hora": 1770056550000
        },
        {
          "acao": "Separado por FIGUEIREDO",
          "hora": 1770065602000
        },
        {
          "acao": "Retirado por LUIZ, conferido por BRUNO",
          "hora": 1770121918000
        }
      ]
    },
    {
      "tipo": "OS",
      "numero": "94204",
      "nome": "S/ TECNICO",
      "vendedor": "MARCELA",
      "dataInstalacao": "",
      "observacao": "",
      "status": "finalizados",
      "criadoEm": "2026-01-22T18:08:32.000Z",
      "historico": [
        {
          "acao": "Criado",
          "hora": 1769105312000
        },
        {
          "acao": "Impresso por JOAO",
          "hora": 1769105317000
        },
        {
          "acao": "Separado por FIGUEIREDO",
          "hora": 1769105330000
        },
        {
          "acao": "Retirado por VINICIUS, conferido por ADRIANO",
          "hora": 1769105422000
        }
      ]
    },
    {
      "tipo": "OS",
      "numero": "96167",
      "nome": "ANDREI",
      "vendedor": "MARCELA",
      "dataInstalacao": "08/01/2026 - Tarde",
      "observacao": "",
      "status": "finalizados",
      "criadoEm": "2026-01-08T11:29:40.000Z",
      "historico": [
        {
          "acao": "Criado",
          "hora": 1767871780000
        },
        {
          "acao": "Impresso por JUNIOR",
          "hora": 1767871797000
        },
        {
          "acao": "Separado por FIGUEIREDO",
          "hora": 1767871811000
        },
        {
          "acao": "Retirado por ANDREI, conferido por ADRIANO",
          "hora": 1767978312000
        }
      ]
    },
    {
      "tipo": "OS",
      "numero": "96269",
      "nome": "ANDREI",
      "vendedor": "MARCELA",
      "dataInstalacao": "09/01/2026 - Tarde",
      "observacao": "",
      "status": "finalizados",
      "criadoEm": "2026-01-07T19:31:49.000Z",
      "historico": [
        {
          "acao": "Criado",
          "hora": 1767814309000
        },
        {
          "acao": "Impresso por JOAO",
          "hora": 1767814742000
        },
        {
          "acao": "Separado por JUNIOR",
          "hora": 1767868776000
        },
        {
          "acao": "Retirado por ANDREI, conferido por ADRIANO",
          "hora": 1767978342000
        }
      ]
    },
    {
      "tipo": "OS",
      "numero": "97153",
      "nome": "BRUNO",
      "vendedor": "ALAN",
      "dataInstalacao": "02/02/2026 - Tarde",
      "observacao": "",
      "status": "finalizados",
      "criadoEm": "2026-02-02T12:20:58.000Z",
      "historico": [
        {
          "acao": "Criado",
          "hora": 1770034858000
        },
        {
          "acao": "Impresso por JUNIOR",
          "hora": 1770034863000
        },
        {
          "acao": "Separado por JUNIOR",
          "hora": 1770034899000
        },
        {
          "acao": "Retirado por BRUNO, conferido por JUNIOR",
          "hora": 1770039410000
        }
      ]
    },
    {
      "tipo": "OS",
      "numero": "96295",
      "nome": "HENRIQUE",
      "vendedor": "ALAN",
      "dataInstalacao": "13/01/2026 - Manhã",
      "observacao": "",
      "status": "finalizados",
      "criadoEm": "2026-01-13T10:30:38.000Z",
      "historico": [
        {
          "acao": "Criado",
          "hora": 1768300238000
        },
        {
          "acao": "Impresso por JUNIOR",
          "hora": 1768300244000
        },
        {
          "acao": "Separado por JUNIOR",
          "hora": 1768300250000
        },
        {
          "acao": "Retirado por REGINALDO, conferido por ADRIANO",
          "hora": 1768392295000
        }
      ]
    },
    {
      "tipo": "OS",
      "numero": "97384",
      "nome": "TIAGO",
      "vendedor": "CAROL",
      "dataInstalacao": "30/01/2026 - Tarde",
      "observacao": "",
      "status": "finalizados",
      "criadoEm": "2026-01-30T17:55:36.000Z",
      "historico": [
        {
          "acao": "Criado",
          "hora": 1769795736000
        },
        {
          "acao": "Impresso por JUNIOR",
          "hora": 1769796294000
        },
        {
          "acao": "Separado por JUNIOR",
          "hora": 1769797621000
        },
        {
          "acao": "Retirado por TIAGO, conferido por ADRIANO",
          "hora": 1769858876000
        }
      ]
    },
    {
      "tipo": "OS",
      "numero": "96945",
      "nome": "VINICIUS",
      "vendedor": "DEBORA",
      "dataInstalacao": "22/01/2026 - Tarde",
      "observacao": "",
      "status": "finalizados",
      "criadoEm": "2026-01-21T19:26:20.000Z",
      "historico": [
        {
          "acao": "Criado",
          "hora": 1769023580000
        },
        {
          "acao": "Impresso por JUNIOR",
          "hora": 1769024880000
        },
        {
          "acao": "Separado por JUNIOR",
          "hora": 1769024886000
        },
        {
          "acao": "Retirado por VINICIUS, conferido por ADRIANO",
          "hora": 1769200624000
        }
      ]
    },
    {
      "tipo": "PV",
      "numero": "143759",
      "nome": "Fuor Tec",
      "vendedor": "LEONARDO",
      "dataInstalacao": "24/01/2026 - Manhã",
      "observacao": "",
      "status": "finalizados",
      "criadoEm": "2026-01-22T15:18:54.000Z",
      "historico": [
        {
          "acao": "Criado",
          "hora": 1769095134000
        },
        {
          "acao": "Impresso por JUNIOR",
          "hora": 1769163821000
        },
        {
          "acao": "Separado por JUNIOR",
          "hora": 1769193451000
        },
        {
          "acao": "Retirado por Agner, conferido por ADRIANO",
          "hora": 1769522986000
        }
      ]
    },
    {
      "tipo": "PV",
      "numero": "143956",
      "nome": "Fuor Tec",
      "vendedor": "LEONARDO",
      "dataInstalacao": "26/01/2026 - Tarde",
      "observacao": "",
      "status": "finalizados",
      "criadoEm": "2026-01-26T17:02:10.000Z",
      "historico": [
        {
          "acao": "Criado",
          "hora": 1769446930000
        },
        {
          "acao": "Impresso por JUNIOR",
          "hora": 1769449217000
        },
        {
          "acao": "Separado por JUNIOR",
          "hora": 1769449228000
        },
        {
          "acao": "Retirado por Agner, conferido por ADRIANO",
          "hora": 1769522974000
        }
      ]
    },
    {
      "tipo": "OS",
      "numero": "96786",
      "nome": "BRUNO",
      "vendedor": "MARCELA",
      "dataInstalacao": "19/01/2026 - Tarde",
      "observacao": "",
      "status": "finalizados",
      "criadoEm": "2026-01-19T14:08:47.000Z",
      "historico": [
        {
          "acao": "Criado",
          "hora": 1768831727000
        },
        {
          "acao": "Impresso por JUNIOR",
          "hora": 1768836118000
        },
        {
          "acao": "Separado por JUNIOR",
          "hora": 1768836992000
        },
        {
          "acao": "Retirado por BRUNO, conferido por ADRIANO",
          "hora": 1768841489000
        }
      ]
    },
    {
      "tipo": "OS",
      "numero": "96379",
      "nome": "MODENA",
      "vendedor": "MARCELA",
      "dataInstalacao": "10/01/2026 - Manhã",
      "observacao": "",
      "status": "finalizados",
      "criadoEm": "2026-01-09T20:32:53.000Z",
      "historico": [
        {
          "acao": "Criado",
          "hora": 1767990773000
        },
        {
          "acao": "Impresso por JUNIOR",
          "hora": 1768043015000
        },
        {
          "acao": "Separado por JUNIOR",
          "hora": 1768044866000
        },
        {
          "acao": "Retirado por MODENA, conferido por ADRIANO",
          "hora": 1768053208000
        }
      ]
    },
    {
      "tipo": "OS",
      "numero": "96515",
      "nome": "REGINALDO",
      "vendedor": "DEBORA",
      "dataInstalacao": "15/01/2026 - Manhã",
      "observacao": "",
      "status": "finalizados",
      "criadoEm": "2026-01-15T11:00:15.000Z",
      "historico": [
        {
          "acao": "Criado",
          "hora": 1768474815000
        },
        {
          "acao": "Impresso por PAULO",
          "hora": 1768479157000
        },
        {
          "acao": "Separado por JUNIOR",
          "hora": 1768483936000
        },
        {
          "acao": "Retirado por REGINALDO, conferido por ADRIANO",
          "hora": 1769200547000
        }
      ]
    },
    {
      "tipo": "PV",
      "numero": "143236",
      "nome": "Audax",
      "vendedor": "LEONARDO",
      "dataInstalacao": "15/01/2026 - Manhã",
      "observacao": "",
      "status": "finalizados",
      "criadoEm": "2026-01-15T11:33:34.000Z",
      "historico": [
        {
          "acao": "Criado",
          "hora": 1768476814000
        },
        {
          "acao": "Impresso por PAULO",
          "hora": 1768478290000
        },
        {
          "acao": "Separado por JUNIOR",
          "hora": 1768487280000
        },
        {
          "acao": "Retirado por UBER, conferido por ADRIANO",
          "hora": 1768841926000
        }
      ]
    },
    {
      "tipo": "OS",
      "numero": "96200",
      "nome": "MODENA",
      "vendedor": "ALAN",
      "dataInstalacao": "06/01/2026 - Tarde",
      "observacao": "",
      "status": "finalizados",
      "criadoEm": "2026-01-06T14:19:44.000Z",
      "historico": [
        {
          "acao": "Criado",
          "hora": 1767709184000
        },
        {
          "acao": "Impresso por JUNIOR",
          "hora": 1767709879000
        },
        {
          "acao": "Separado por PAULO",
          "hora": 1767723138000
        },
        {
          "acao": "Retirado por MODENA, conferido por ADRIANO",
          "hora": 1767723145000
        }
      ]
    },
    {
      "tipo": "OS",
      "numero": "96149",
      "nome": "ANDREI",
      "vendedor": "CAROL",
      "dataInstalacao": "12/01/2026 - Manhã",
      "observacao": "",
      "status": "finalizados",
      "criadoEm": "2026-01-05T19:55:54.000Z",
      "historico": [
        {
          "acao": "Criado",
          "hora": 1767642954000
        },
        {
          "acao": "Impresso por JUNIOR",
          "hora": 1767643539000
        },
        {
          "acao": "Separado por PAULO",
          "hora": 1768050736000
        },
        {
          "acao": "Retirado por ANDREI, conferido por ADRIANO",
          "hora": 1768233208000
        }
      ]
    },
    {
      "tipo": "OS",
      "numero": "96254",
      "nome": "ANDREI",
      "vendedor": "MARCELA",
      "dataInstalacao": "09/01/2026 - Tarde",
      "observacao": "",
      "status": "finalizados",
      "criadoEm": "2026-01-07T16:27:03.000Z",
      "historico": [
        {
          "acao": "Criado",
          "hora": 1767803223000
        },
        {
          "acao": "Impresso por JUNIOR",
          "hora": 1767805884000
        },
        {
          "acao": "Separado por PAULO",
          "hora": 1767969361000
        },
        {
          "acao": "Retirado por ANDREI, conferido por ADRIANO",
          "hora": 1767978384000
        }
      ]
    },
    {
      "tipo": "OS",
      "numero": "96291",
      "nome": "ANDREI",
      "vendedor": "MARCELA",
      "dataInstalacao": "09/01/2026 - Tarde",
      "observacao": "",
      "status": "finalizados",
      "criadoEm": "2026-01-08T13:46:57.000Z",
      "historico": [
        {
          "acao": "Criado",
          "hora": 1767880017000
        },
        {
          "acao": "Impresso por JUNIOR",
          "hora": 1767881411000
        },
        {
          "acao": "Separado por PAULO",
          "hora": 1767969375000
        },
        {
          "acao": "Retirado por ANDREI, conferido por ADRIANO",
          "hora": 1767978365000
        }
      ]
    },
    {
      "tipo": "OS",
      "numero": "97353",
      "nome": "HENRIQUE",
      "vendedor": "CAROL",
      "dataInstalacao": "31/01/2026 - Manhã",
      "observacao": "",
      "status": "finalizados",
      "criadoEm": "2026-01-30T15:43:00.000Z",
      "historico": [
        {
          "acao": "Criado",
          "hora": 1769787780000
        },
        {
          "acao": "Impresso por PAULO",
          "hora": 1769804586000
        },
        {
          "acao": "Separado por PAULO",
          "hora": 1769806593000
        },
        {
          "acao": "Retirado por HENRIQUE, conferido por ADRIANO",
          "hora": 1769860366000
        }
      ]
    },
    {
      "tipo": "OS",
      "numero": "97272",
      "nome": "TIAGO",
      "vendedor": "CAROL",
      "dataInstalacao": "30/01/2026 - Manhã",
      "observacao": "",
      "status": "finalizados",
      "criadoEm": "2026-01-29T11:12:53.000Z",
      "historico": [
        {
          "acao": "Criado",
          "hora": 1769685173000
        },
        {
          "acao": "Impresso por PAULO",
          "hora": 1769695537000
        },
        {
          "acao": "Separado por PAULO",
          "hora": 1769713678000
        },
        {
          "acao": "Retirado por TIAGO, conferido por ADRIANO",
          "hora": 1769858900000
        }
      ]
    },
    {
      "tipo": "OS",
      "numero": "97172",
      "nome": "HENRIQUE",
      "vendedor": "CAROL",
      "dataInstalacao": "26/01/2026 - Tarde",
      "observacao": "",
      "status": "finalizados",
      "criadoEm": "2026-01-26T16:32:31.000Z",
      "historico": [
        {
          "acao": "Criado",
          "hora": 1769445151000
        },
        {
          "acao": "Impresso por PAULO",
          "hora": 1769445316000
        },
        {
          "acao": "Separado por PAULO",
          "hora": 1769446544000
        },
        {
          "acao": "Retirado por HENRIQUE, conferido por ADRIANO",
          "hora": 1769448366000
        }
      ]
    },
    {
      "tipo": "PV",
      "numero": "143697",
      "nome": "FIDUCIA SINDICOS",
      "vendedor": "FABIANO",
      "dataInstalacao": "22/01/2026 - Manhã",
      "observacao": "",
      "status": "finalizados",
      "criadoEm": "2026-01-22T10:34:01.000Z",
      "historico": [
        {
          "acao": "Criado",
          "hora": 1769078041000
        },
        {
          "acao": "Impresso por PAULO",
          "hora": 1769078659000
        },
        {
          "acao": "Separado por PAULO",
          "hora": 1769092682000
        },
        {
          "acao": "Retirado por ENTREGUE PELO ADRIANO, conferido por ADRIANO",
          "hora": 1769092732000
        }
      ]
    },
    {
      "tipo": "PV",
      "numero": "143696",
      "nome": "KALIL",
      "vendedor": "FABIANO",
      "dataInstalacao": "22/01/2026 - Manhã",
      "observacao": "",
      "status": "finalizados",
      "criadoEm": "2026-01-22T10:37:22.000Z",
      "historico": [
        {
          "acao": "Criado",
          "hora": 1769078242000
        },
        {
          "acao": "Impresso por PAULO",
          "hora": 1769078702000
        },
        {
          "acao": "Separado por PAULO",
          "hora": 1769092675000
        },
        {
          "acao": "Retirado por ENTREGUE PELO ADRIANO, conferido por ADRIANO",
          "hora": 1769092717000
        }
      ]
    },
    {
      "tipo": "OS",
      "numero": "96352",
      "nome": "TIAGO",
      "vendedor": "LUIZ",
      "dataInstalacao": "15/01/2026 - Tarde",
      "observacao": "",
      "status": "finalizados",
      "criadoEm": "2026-01-15T16:38:03.000Z",
      "historico": [
        {
          "acao": "Criado",
          "hora": 1768495083000
        },
        {
          "acao": "Impresso por PAULO",
          "hora": 1768495912000
        },
        {
          "acao": "Separado por PAULO",
          "hora": 1768495920000
        },
        {
          "acao": "Retirado por VENDEDOR LUIZ, conferido por ADRIANO",
          "hora": 1768495933000
        }
      ]
    },
    {
      "tipo": "PV",
      "numero": "0",
      "nome": "RAFAEL STRADIOTTO",
      "vendedor": "ALAN",
      "dataInstalacao": "07/02/2026 - Tarde",
      "observacao": "",
      "status": "finalizados",
      "criadoEm": "2026-02-07T14:55:03.000Z",
      "historico": [
        {
          "acao": "Criado",
          "hora": 1770476103000
        },
        {
          "acao": "Impresso por ALAN",
          "hora": 1770635841000
        },
        {
          "acao": "Separado por ADRIANO",
          "hora": 1770635850000
        },
        {
          "acao": "Retirado por BALCAO, conferido por PAULO",
          "hora": 1770635867000
        }
      ]
    },
    {
      "tipo": "PV",
      "numero": "144188",
      "nome": "NATALINO DE FREITAS",
      "vendedor": "ALAN",
      "dataInstalacao": "28/01/2026 - Tarde",
      "observacao": "",
      "status": "finalizados",
      "criadoEm": "2026-01-28T19:34:30.000Z",
      "historico": [
        {
          "acao": "Criado",
          "hora": 1769628870000
        },
        {
          "acao": "Impresso por PAULO",
          "hora": 1769628873000
        },
        {
          "acao": "Separado por PAULO",
          "hora": 1769628878000
        },
        {
          "acao": "Retirado por NATALINO, conferido por PAULO",
          "hora": 1769628892000
        }
      ]
    },
    {
      "tipo": "OS",
      "numero": "96397",
      "nome": "MARCIO",
      "vendedor": "TIAGO TROJAN",
      "dataInstalacao": "10/01/2026 - Manhã",
      "observacao": "",
      "status": "finalizados",
      "criadoEm": "2026-01-10T13:26:55.000Z",
      "historico": [
        {
          "acao": "Criado",
          "hora": 1768051615000
        },
        {
          "acao": "Impresso por JUNIOR",
          "hora": 1768052323000
        },
        {
          "acao": "Separado por ADRIANO",
          "hora": 1768053393000
        },
        {
          "acao": "Retirado por MARCIO, conferido por BRUNO",
          "hora": 1768403637000
        }
      ]
    },
    {
      "tipo": "OS",
      "numero": "96994",
      "nome": "ROGER",
      "vendedor": "ANDRESSA",
      "dataInstalacao": "28/01/2026 - Manhã",
      "observacao": "",
      "status": "finalizados",
      "criadoEm": "2026-01-28T11:17:04.000Z",
      "historico": [
        {
          "acao": "Criado",
          "hora": 1769599024000
        },
        {
          "acao": "Impresso por BRUNO",
          "hora": 1769599033000
        },
        {
          "acao": "Separado por BRUNO",
          "hora": 1769599040000
        },
        {
          "acao": "Retirado por ROGER, conferido por BRUNO",
          "hora": 1769599047000
        }
      ]
    },
    {
      "tipo": "OS",
      "numero": "97018",
      "nome": "ROGER",
      "vendedor": "ANDRESSA",
      "dataInstalacao": "28/01/2026 - Manhã",
      "observacao": "",
      "status": "finalizados",
      "criadoEm": "2026-01-28T11:15:32.000Z",
      "historico": [
        {
          "acao": "Criado",
          "hora": 1769598932000
        },
        {
          "acao": "Impresso por BRUNO",
          "hora": 1769598943000
        },
        {
          "acao": "Separado por BRUNO",
          "hora": 1769598947000
        },
        {
          "acao": "Retirado por ROGER, conferido por BRUNO",
          "hora": 1769598955000
        }
      ]
    },
    {
      "tipo": "OS",
      "numero": "97609",
      "nome": "MARCIO",
      "vendedor": "BRUNO",
      "dataInstalacao": "06/02/2026 - Manhã",
      "observacao": "",
      "status": "finalizados",
      "criadoEm": "2026-02-06T11:39:18.000Z",
      "historico": [
        {
          "acao": "Criado",
          "hora": 1770377958000
        },
        {
          "acao": "Impresso por BRUNO",
          "hora": 1770377966000
        },
        {
          "acao": "Separado por BRUNO",
          "hora": 1770377969000
        },
        {
          "acao": "Retirado por MARCIO, conferido por BRUNO",
          "hora": 1770377978000
        }
      ]
    },
    {
      "tipo": "PV",
      "numero": "144740",
      "nome": "DANIEL SOFFI",
      "vendedor": "BRUNO",
      "dataInstalacao": "05/02/2026 - Tarde",
      "observacao": "",
      "status": "finalizados",
      "criadoEm": "2026-02-05T16:55:06.000Z",
      "historico": [
        {
          "acao": "Criado",
          "hora": 1770310506000
        },
        {
          "acao": "Impresso por BRUNO",
          "hora": 1770310519000
        },
        {
          "acao": "Separado por BRUNO",
          "hora": 1770310523000
        },
        {
          "acao": "Retirado por DANIEL SOFFI, conferido por BRUNO",
          "hora": 1770310534000
        }
      ]
    },
    {
      "tipo": "PV",
      "numero": "144736",
      "nome": "JULIO",
      "vendedor": "BRUNO",
      "dataInstalacao": "05/02/2026 - Tarde",
      "observacao": "",
      "status": "finalizados",
      "criadoEm": "2026-02-05T16:13:08.000Z",
      "historico": [
        {
          "acao": "Criado",
          "hora": 1770307988000
        },
        {
          "acao": "Impresso por BRUNO",
          "hora": 1770307997000
        },
        {
          "acao": "Separado por BRUNO",
          "hora": 1770308001000
        },
        {
          "acao": "Retirado por JULIO, conferido por BRUNO",
          "hora": 1770308013000
        }
      ]
    },
    {
      "tipo": "PV",
      "numero": "144722",
      "nome": "ALISSON",
      "vendedor": "BRUNO",
      "dataInstalacao": "05/02/2026 - Manhã",
      "observacao": "",
      "status": "finalizados",
      "criadoEm": "2026-02-05T14:17:49.000Z",
      "historico": [
        {
          "acao": "Criado",
          "hora": 1770301069000
        },
        {
          "acao": "Impresso por BRUNO",
          "hora": 1770301079000
        },
        {
          "acao": "Separado por BRUNO",
          "hora": 1770301085000
        },
        {
          "acao": "Retirado por ALISSON, conferido por BRUNO",
          "hora": 1770301095000
        }
      ]
    },
    {
      "tipo": "OS",
      "numero": "97550",
      "nome": "TIAGO",
      "vendedor": "BRUNO",
      "dataInstalacao": "04/02/2026 - Manhã",
      "observacao": "",
      "status": "finalizados",
      "criadoEm": "2026-02-04T11:19:03.000Z",
      "historico": [
        {
          "acao": "Criado",
          "hora": 1770203943000
        },
        {
          "acao": "Impresso por BRUNO",
          "hora": 1770203957000
        },
        {
          "acao": "Separado por BRUNO",
          "hora": 1770203962000
        },
        {
          "acao": "Retirado por TIAGO, conferido por BRUNO",
          "hora": 1770203976000
        }
      ]
    },
    {
      "tipo": "PV",
      "numero": "144585",
      "nome": "TIAGO",
      "vendedor": "BRUNO",
      "dataInstalacao": "03/02/2026 - Tarde",
      "observacao": "",
      "status": "finalizados",
      "criadoEm": "2026-02-03T16:56:25.000Z",
      "historico": [
        {
          "acao": "Criado",
          "hora": 1770137785000
        },
        {
          "acao": "Impresso por BRUNO",
          "hora": 1770137817000
        },
        {
          "acao": "Separado por BRUNO",
          "hora": 1770137822000
        },
        {
          "acao": "Retirado por TIAGO, conferido por BRUNO",
          "hora": 1770137830000
        }
      ]
    },
    {
      "tipo": "PV",
      "numero": "144132",
      "nome": "KALIL",
      "vendedor": "BRUNO",
      "dataInstalacao": "28/01/2026 - Manhã",
      "observacao": "",
      "status": "finalizados",
      "criadoEm": "2026-01-28T14:25:04.000Z",
      "historico": [
        {
          "acao": "Criado",
          "hora": 1769610304000
        },
        {
          "acao": "Impresso por BRUNO",
          "hora": 1769610317000
        },
        {
          "acao": "Separado por BRUNO",
          "hora": 1769610322000
        },
        {
          "acao": "Retirado por KALIL, conferido por BRUNO",
          "hora": 1769610331000
        }
      ]
    },
    {
      "tipo": "PV",
      "numero": "143952",
      "nome": "ROBERTO",
      "vendedor": "BRUNO",
      "dataInstalacao": "26/01/2026 - Tarde",
      "observacao": "",
      "status": "finalizados",
      "criadoEm": "2026-01-26T16:23:15.000Z",
      "historico": [
        {
          "acao": "Criado",
          "hora": 1769444595000
        },
        {
          "acao": "Impresso por BRUNO",
          "hora": 1769444601000
        },
        {
          "acao": "Separado por BRUNO",
          "hora": 1769444607000
        },
        {
          "acao": "Retirado por MOTO UBER, conferido por BRUNO",
          "hora": 1769542838000
        }
      ]
    },
    {
      "tipo": "OS",
      "numero": "97133",
      "nome": "TIAGO",
      "vendedor": "BRUNO",
      "dataInstalacao": "26/01/2026 - Tarde",
      "observacao": "",
      "status": "finalizados",
      "criadoEm": "2026-01-26T17:13:05.000Z",
      "historico": [
        {
          "acao": "Criado",
          "hora": 1769447585000
        },
        {
          "acao": "Impresso por BRUNO",
          "hora": 1769447599000
        },
        {
          "acao": "Separado por BRUNO",
          "hora": 1769447605000
        },
        {
          "acao": "Retirado por TIAGO, conferido por BRUNO",
          "hora": 1769447616000
        }
      ]
    },
    {
      "tipo": "OS",
      "numero": "97615",
      "nome": "andrei",
      "vendedor": "CAROL",
      "dataInstalacao": "06/02/2026 - Manhã",
      "observacao": "",
      "status": "finalizados",
      "criadoEm": "2026-02-05T15:24:49.000Z",
      "historico": [
        {
          "acao": "Criado",
          "hora": 1770305089000
        },
        {
          "acao": "Impresso por BRUNO",
          "hora": 1770308346000
        },
        {
          "acao": "Separado por BRUNO",
          "hora": 1770387425000
        },
        {
          "acao": "Retirado por ANDREI, conferido por BRUNO",
          "hora": 1770387436000
        }
      ]
    },
    {
      "tipo": "OS",
      "numero": "97241",
      "nome": "MARCIO",
      "vendedor": "DEBORA",
      "dataInstalacao": "28/01/2026 - Tarde",
      "observacao": "",
      "status": "finalizados",
      "criadoEm": "2026-01-28T20:45:52.000Z",
      "historico": [
        {
          "acao": "Criado",
          "hora": 1769633152000
        },
        {
          "acao": "Impresso por BRUNO",
          "hora": 1769633161000
        },
        {
          "acao": "Separado por BRUNO",
          "hora": 1769633167000
        },
        {
          "acao": "Retirado por MARCIO, conferido por BRUNO",
          "hora": 1769633175000
        }
      ]
    },
    {
      "tipo": "OS",
      "numero": "97623",
      "nome": "MARCIO",
      "vendedor": "JOAO",
      "dataInstalacao": "",
      "observacao": "",
      "status": "finalizados",
      "criadoEm": "2026-02-06T11:11:09.000Z",
      "historico": [
        {
          "acao": "Criado",
          "hora": 1770376269000
        },
        {
          "acao": "Impresso por BRUNO",
          "hora": 1770377911000
        },
        {
          "acao": "Separado por BRUNO",
          "hora": 1770377917000
        },
        {
          "acao": "Retirado por MARCIO, conferido por BRUNO",
          "hora": 1770377924000
        }
      ]
    },
    {
      "tipo": "OS",
      "numero": "96477",
      "nome": "HEBRON",
      "vendedor": "JOCISLAINE",
      "dataInstalacao": "29/01/2026 - Manhã",
      "observacao": "",
      "status": "finalizados",
      "criadoEm": "2026-01-28T12:50:46.000Z",
      "historico": [
        {
          "acao": "Criado",
          "hora": 1769604646000
        },
        {
          "acao": "Impresso por BRUNO",
          "hora": 1769604652000
        },
        {
          "acao": "Separado por BRUNO",
          "hora": 1769604659000
        },
        {
          "acao": "Retirado por HEBRON, conferido por BRUNO",
          "hora": 1769630316000
        }
      ]
    },
    {
      "tipo": "PV",
      "numero": "144840",
      "nome": "Via Gás",
      "vendedor": "LEONARDO",
      "dataInstalacao": "07/02/2026 - Manhã",
      "observacao": "",
      "status": "finalizados",
      "criadoEm": "2026-02-07T11:31:15.000Z",
      "historico": [
        {
          "acao": "Criado",
          "hora": 1770463875000
        },
        {
          "acao": "Impresso por BRUNO",
          "hora": 1770464110000
        },
        {
          "acao": "Separado por BRUNO",
          "hora": 1770464919000
        },
        {
          "acao": "Retirado por VIA GAS, conferido por BRUNO",
          "hora": 1770464936000
        }
      ]
    },
    {
      "tipo": "PV",
      "numero": "144668",
      "nome": "RL Service",
      "vendedor": "LEONARDO",
      "dataInstalacao": "04/02/2026 - Tarde",
      "observacao": "",
      "status": "finalizados",
      "criadoEm": "2026-02-04T16:37:50.000Z",
      "historico": [
        {
          "acao": "Criado",
          "hora": 1770223070000
        },
        {
          "acao": "Impresso por BRUNO",
          "hora": 1770223506000
        },
        {
          "acao": "Separado por BRUNO",
          "hora": 1770223511000
        },
        {
          "acao": "Retirado por RODRIGO, conferido por BRUNO",
          "hora": 1770223520000
        }
      ]
    },
    {
      "tipo": "PV",
      "numero": "144273",
      "nome": "D MARTINS",
      "vendedor": "LUIZ",
      "dataInstalacao": "29/01/2026 - Tarde",
      "observacao": "",
      "status": "finalizados",
      "criadoEm": "2026-01-29T18:15:37.000Z",
      "historico": [
        {
          "acao": "Criado",
          "hora": 1769710537000
        },
        {
          "acao": "Impresso por BRUNO",
          "hora": 1769710548000
        },
        {
          "acao": "Separado por BRUNO",
          "hora": 1769710572000
        },
        {
          "acao": "Retirado por LUIZ, conferido por BRUNO",
          "hora": 1769710585000
        }
      ]
    },
    {
      "tipo": "OS",
      "numero": "97679",
      "nome": "TIAGO ZILIOTTO",
      "vendedor": "TIAGO TROJAN",
      "dataInstalacao": "06/02/2026 - Tarde",
      "observacao": "",
      "status": "finalizados",
      "criadoEm": "2026-02-06T16:46:48.000Z",
      "historico": [
        {
          "acao": "Criado",
          "hora": 1770396408000
        },
        {
          "acao": "Impresso por BRUNO",
          "hora": 1770398180000
        },
        {
          "acao": "Separado por BRUNO",
          "hora": 1770399253000
        },
        {
          "acao": "Retirado por TIAGO, conferido por BRUNO",
          "hora": 1770399285000
        }
      ]
    },
    {
      "tipo": "OS",
      "numero": "97086",
      "nome": "MARCIO",
      "vendedor": "CAROL",
      "dataInstalacao": "23/01/2026 - Tarde",
      "observacao": "",
      "status": "finalizados",
      "criadoEm": "2026-01-23T16:59:29.000Z",
      "historico": [
        {
          "acao": "Criado",
          "hora": 1769187569000
        },
        {
          "acao": "Impresso por FABIANO",
          "hora": 1769187696000
        },
        {
          "acao": "Separado por BRUNO",
          "hora": 1769188852000
        },
        {
          "acao": "Retirado por MARCIO, conferido por BRUNO",
          "hora": 1769188866000
        }
      ]
    },
    {
      "tipo": "PV",
      "numero": "144845",
      "nome": "GABRIEL",
      "vendedor": "FABIANO",
      "dataInstalacao": "07/02/2026 - Manhã",
      "observacao": "",
      "status": "finalizados",
      "criadoEm": "2026-02-07T12:10:34.000Z",
      "historico": [
        {
          "acao": "Criado",
          "hora": 1770466234000
        },
        {
          "acao": "Impresso por FABIANO",
          "hora": 1770466240000
        },
        {
          "acao": "Separado por BRUNO",
          "hora": 1770466246000
        },
        {
          "acao": "Retirado por GABRIEL, conferido por BRUNO",
          "hora": 1770466256000
        }
      ]
    },
    {
      "tipo": "PV",
      "numero": "144521",
      "nome": "WF AQUECEDORES",
      "vendedor": "FABIANO",
      "dataInstalacao": "02/02/2026 - Tarde",
      "observacao": "",
      "status": "finalizados",
      "criadoEm": "2026-02-02T16:37:57.000Z",
      "historico": [
        {
          "acao": "Criado",
          "hora": 1770050277000
        },
        {
          "acao": "Impresso por FABIANO",
          "hora": 1770050279000
        },
        {
          "acao": "Separado por BRUNO",
          "hora": 1770050638000
        },
        {
          "acao": "Retirado por LEANDRO, conferido por BRUNO",
          "hora": 1770050648000
        }
      ]
    },
    {
      "tipo": "PV",
      "numero": "144269",
      "nome": "AGAS",
      "vendedor": "FABIANO",
      "dataInstalacao": "29/01/2026 - Tarde",
      "observacao": "",
      "status": "finalizados",
      "criadoEm": "2026-01-29T17:55:35.000Z",
      "historico": [
        {
          "acao": "Criado",
          "hora": 1769709335000
        },
        {
          "acao": "Impresso por FABIANO",
          "hora": 1769709353000
        },
        {
          "acao": "Separado por BRUNO",
          "hora": 1769709658000
        },
        {
          "acao": "Retirado por AGAZ, conferido por BRUNO",
          "hora": 1769709668000
        }
      ]
    },
    {
      "tipo": "PV",
      "numero": "144151",
      "nome": "MARCELA",
      "vendedor": "MARCELA",
      "dataInstalacao": "28/01/2026 - Tarde",
      "observacao": "",
      "status": "finalizados",
      "criadoEm": "2026-01-28T17:19:11.000Z",
      "historico": [
        {
          "acao": "Criado",
          "hora": 1769620751000
        },
        {
          "acao": "Impresso por FABIANO",
          "hora": 1769624888000
        },
        {
          "acao": "Separado por BRUNO",
          "hora": 1769624896000
        },
        {
          "acao": "Retirado por VINICIUS, conferido por BRUNO",
          "hora": 1769624930000
        }
      ]
    },
    {
      "tipo": "OS",
      "numero": "97171",
      "nome": "ROGER",
      "vendedor": "ANDRESSA",
      "dataInstalacao": "28/01/2026 - Tarde",
      "observacao": "",
      "status": "finalizados",
      "criadoEm": "2026-01-26T18:00:51.000Z",
      "historico": [
        {
          "acao": "Criado",
          "hora": 1769450451000
        },
        {
          "acao": "Impresso por JOAO",
          "hora": 1769526453000
        },
        {
          "acao": "Separado por BRUNO",
          "hora": 1769599211000
        },
        {
          "acao": "Retirado por ROGER, conferido por BRUNO",
          "hora": 1769599219000
        }
      ]
    },
    {
      "tipo": "OS",
      "numero": "97442",
      "nome": "FABRICIO",
      "vendedor": "ALAN",
      "dataInstalacao": "",
      "observacao": "",
      "status": "finalizados",
      "criadoEm": "2026-02-04T15:59:53.000Z",
      "historico": [
        {
          "acao": "Criado",
          "hora": 1770220793000
        },
        {
          "acao": "Impresso por JOAO",
          "hora": 1770220796000
        },
        {
          "acao": "Separado por JOAO",
          "hora": 1770220800000
        },
        {
          "acao": "Retirado por FABRICIO, conferido por JOAO",
          "hora": 1770220805000
        }
      ]
    },
    {
      "tipo": "OS",
      "numero": "97281",
      "nome": "VINICIUS",
      "vendedor": "MARCELA",
      "dataInstalacao": "28/01/2026 - Tarde",
      "observacao": "",
      "status": "finalizados",
      "criadoEm": "2026-01-28T15:33:06.000Z",
      "historico": [
        {
          "acao": "Criado",
          "hora": 1769614386000
        },
        {
          "acao": "Impresso por JUNIOR",
          "hora": 1769614637000
        },
        {
          "acao": "Separado por BRUNO",
          "hora": 1769624837000
        },
        {
          "acao": "Retirado por VINICIUS, conferido por BRUNO",
          "hora": 1769624846000
        }
      ]
    },
    {
      "tipo": "PV",
      "numero": "144525",
      "nome": "Vegas Instalações",
      "vendedor": "LEONARDO",
      "dataInstalacao": "02/02/2026 - Tarde",
      "observacao": "",
      "status": "finalizados",
      "criadoEm": "2026-02-02T18:42:55.000Z",
      "historico": [
        {
          "acao": "Criado",
          "hora": 1770057775000
        },
        {
          "acao": "Impresso por LEONARDO",
          "hora": 1770058091000
        },
        {
          "acao": "Separado por BRUNO",
          "hora": 1770058568000
        },
        {
          "acao": "Retirado por VEGAS, conferido por BRUNO",
          "hora": 1770058576000
        }
      ]
    },
    {
      "tipo": "PV",
      "numero": "143769",
      "nome": "R E B INSTALAÇÕES",
      "vendedor": "LEONARDO",
      "dataInstalacao": "22/01/2026 - Tarde",
      "observacao": "",
      "status": "finalizados",
      "criadoEm": "2026-01-22T17:48:34.000Z",
      "historico": [
        {
          "acao": "Criado",
          "hora": 1769104114000
        },
        {
          "acao": "Impresso por LEONARDO",
          "hora": 1769104131000
        },
        {
          "acao": "Separado por BRUNO",
          "hora": 1769104144000
        },
        {
          "acao": "Retirado por R E B INSTALAÇÕES, conferido por BRUNO",
          "hora": 1769104176000
        }
      ]
    },
    {
      "tipo": "PV",
      "numero": "143829",
      "nome": "MAGIC LAMP",
      "vendedor": "BRUNO",
      "dataInstalacao": "23/01/2026 - Tarde",
      "observacao": "",
      "status": "finalizados",
      "criadoEm": "2026-01-23T17:56:28.000Z",
      "historico": [
        {
          "acao": "Criado",
          "hora": 1769190988000
        },
        {
          "acao": "Impresso por BRUNO",
          "hora": 1769191000000
        },
        {
          "acao": "Separado por FIGUEIREDO",
          "hora": 1769191021000
        },
        {
          "acao": "Retirado por MAGIC LAMP, conferido por BRUNO",
          "hora": 1769191031000
        }
      ]
    },
    {
      "tipo": "PV",
      "numero": "2226",
      "nome": "Provessi Aquecedores",
      "vendedor": "LEONARDO",
      "dataInstalacao": "28/01/2026 - Tarde",
      "observacao": "",
      "status": "finalizados",
      "criadoEm": "2026-01-28T11:42:19.000Z",
      "historico": [
        {
          "acao": "Criado",
          "hora": 1769600539000
        },
        {
          "acao": "Impresso por JOAO",
          "hora": 1769604308000
        },
        {
          "acao": "Separado por FIGUEIREDO",
          "hora": 1769619159000
        },
        {
          "acao": "Retirado por FIGUEIREDO, conferido por BRUNO",
          "hora": 1769619171000
        }
      ]
    },
    {
      "tipo": "OS",
      "numero": "96467",
      "nome": "Clayton",
      "vendedor": "ANDRESSA",
      "dataInstalacao": "14/01/2026 - Manhã",
      "observacao": "",
      "status": "finalizados",
      "criadoEm": "2026-01-13T17:07:27.000Z",
      "historico": [
        {
          "acao": "Criado",
          "hora": 1768324047000
        },
        {
          "acao": "Impresso por PAULO",
          "hora": 1768326441000
        },
        {
          "acao": "Separado por FIGUEIREDO",
          "hora": 1768333363000
        },
        {
          "acao": "Retirado por CLAYTON, conferido por BRUNO",
          "hora": 1768391687000
        }
      ]
    },
    {
      "tipo": "PV",
      "numero": "144033",
      "nome": "Aquece Mais São Paulo",
      "vendedor": "LEONARDO",
      "dataInstalacao": "27/01/2026 - Tarde",
      "observacao": "",
      "status": "finalizados",
      "criadoEm": "2026-01-27T14:09:17.000Z",
      "historico": [
        {
          "acao": "Criado",
          "hora": 1769522957000
        },
        {
          "acao": "Impresso por PAULO",
          "hora": 1769524016000
        },
        {
          "acao": "Separado por FIGUEIREDO",
          "hora": 1769541023000
        },
        {
          "acao": "Retirado por RODONAVES, conferido por BRUNO",
          "hora": 1769542818000
        }
      ]
    },
    {
      "tipo": "OS",
      "numero": "96505",
      "nome": "CLAYTON",
      "vendedor": "MARCELA",
      "dataInstalacao": "14/01/2026 - Manhã",
      "observacao": "",
      "status": "finalizados",
      "criadoEm": "2026-01-13T15:31:34.000Z",
      "historico": [
        {
          "acao": "Criado",
          "hora": 1768318294000
        },
        {
          "acao": "Impresso por PAULO",
          "hora": 1768326104000
        },
        {
          "acao": "Separado por FIGUEIREDO",
          "hora": 1768330076000
        },
        {
          "acao": "Retirado por CLAYTON, conferido por BRUNO",
          "hora": 1768391746000
        }
      ]
    },
    {
      "tipo": "PV",
      "numero": "144047",
      "nome": "IVONETE",
      "vendedor": "FABIANO",
      "dataInstalacao": "27/01/2026 - Manhã",
      "observacao": "",
      "status": "finalizados",
      "criadoEm": "2026-01-27T14:47:34.000Z",
      "historico": [
        {
          "acao": "Criado",
          "hora": 1769525254000
        },
        {
          "acao": "Impresso por FABIANO",
          "hora": 1769525264000
        },
        {
          "acao": "Separado por JOAO",
          "hora": 1769529886000
        },
        {
          "acao": "Retirado por LUIZ CARLOS, conferido por BRUNO",
          "hora": 1769531985000
        }
      ]
    },
    {
      "tipo": "OS",
      "numero": "96656",
      "nome": "TIAGO",
      "vendedor": "DEBORA",
      "dataInstalacao": "16/01/2026 - Manhã",
      "observacao": "",
      "status": "finalizados",
      "criadoEm": "2026-01-15T19:31:50.000Z",
      "historico": [
        {
          "acao": "Criado",
          "hora": 1768505510000
        },
        {
          "acao": "Impresso por JOAO",
          "hora": 1768506478000
        },
        {
          "acao": "Separado por JOAO",
          "hora": 1768507573000
        },
        {
          "acao": "Retirado por TIAGO, conferido por BRUNO",
          "hora": 1768648800000
        }
      ]
    },
    {
      "tipo": "OS",
      "numero": "97529",
      "nome": "ANDREI",
      "vendedor": "CAROL",
      "dataInstalacao": "06/02/2026 - Manhã",
      "observacao": "",
      "status": "finalizados",
      "criadoEm": "2026-02-03T19:03:19.000Z",
      "historico": [
        {
          "acao": "Criado",
          "hora": 1770145399000
        },
        {
          "acao": "Impresso por JUNIOR",
          "hora": 1770145748000
        },
        {
          "acao": "Separado por JOAO",
          "hora": 1770323128000
        },
        {
          "acao": "Retirado por ANDREI, conferido por BRUNO",
          "hora": 1770387543000
        }
      ]
    },
    {
      "tipo": "OS",
      "numero": "96095",
      "nome": "TIAGO",
      "vendedor": "DEBORA",
      "dataInstalacao": "",
      "observacao": "",
      "status": "finalizados",
      "criadoEm": "2026-01-22T18:06:27.000Z",
      "historico": [
        {
          "acao": "Criado",
          "hora": 1769105187000
        },
        {
          "acao": "Impresso por JOAO",
          "hora": 1769105196000
        },
        {
          "acao": "Separado por JUNIOR",
          "hora": 1769105202000
        },
        {
          "acao": "Retirado por TIAGO, conferido por BRUNO",
          "hora": 1769200750000
        }
      ]
    },
    {
      "tipo": "OS",
      "numero": "97473",
      "nome": "ANDREI",
      "vendedor": "CAROL",
      "dataInstalacao": "06/02/2026 - Manhã",
      "observacao": "",
      "status": "finalizados",
      "criadoEm": "2026-02-06T10:30:36.000Z",
      "historico": [
        {
          "acao": "Criado",
          "hora": 1770373836000
        },
        {
          "acao": "Impresso por JUNIOR",
          "hora": 1770377455000
        },
        {
          "acao": "Separado por JUNIOR",
